data,index,count,bow,tfidf,lstm,gru
ces tgp supply needs atta i,46798,1,0,0,0,1
michcon noms for just spoke with kelly naragon w michcon and we are allowed to nom late for she said their gas control group will work with us,47018,1,0,0,0,1
tgt contract i just killed deal tgt k t that was the wrong contract number,47255,1,0,0,0,1
meeting with houston settlements chris i understand that virginia has been approached to head down to houston and meet with the settlements group i would like to be part of that as well if that is alright there are still some things they do on their side that i would like to learn about and i think that virginia and i could collaborate on a sharing of information meeting and both would get a lot out of it let me know i guess the date hasnt been settled yet but i am available pretty much any time in the next few weeks c,48059,1,0,0,0,1
ferc order hey just wanted to clarify the capping in the new order during non emergency hours the region wide cap is at of the highest price bid during the last stage emergency during emergency hours the price mitigation rules are the same based on the operating costs of the least efficient generator good to chat with you this morning i hope that things start to look up soon ill keep my fingers crossed,48322,1,0,0,0,1
houston what is your msn id mine is badmojo msn com houston stokley give me a shout when you get in and i now use msn messenger had to delete the yahoo houston chad i will be in houston next week make some room on your busy schedule i will give you an update on what is going on when i get there also are you using a new im system i never see you on the yahoo system me,48560,1,0,0,0,1
update information steve i dont see the attachment as far as the percentage of calf contracts that have band consumption my assumption is that it is quite high i base this on our discussion w dennis and my talks w neil bresnen my understanding is that all contracts that where written after first quarter of have some type of band consumption language in them i spoke w joshua yesterday and i feel that we are making the progress that i would expect at this point i would like to meet w you when i get back in houston on monday if you have the time also joshua is supposed to send me an update today so that i can better assess as to where we are at on the consumption band initiative ps sorry i am late getting back w you i could get into my e mail yesterday but could not send out any e mail i still owe you the project phoenix list also do we still need to meet w kristian and murray chris update information attached is a spreadsheet created by kpmg with some results from csc data and rps testing done on california this is just for your information do you have any idea what percentage of contracts will have a band consumption i am trying to understand your personnel needs to accomplish your objectives you can give me a call to discuss or just respond via email thanks steve,49552,1,0,0,0,1
msal both i would like to have a complete understanding of what msal will provide upon completion also i would like to set up a meeting with you sometime tomorrow to get your input on some of the issues i am running into on the lack of a given baseline in most of the contracts that the kpmg group are going through thanks for your help on these items chris end of signature msal chris i know you asked me for some information related to the msal after our staff meeting yesterday exactly what do you want to see a process flow or the data points we are considering for the system please advise so i know better what to provide thanks,49603,1,0,0,0,1
reschedule consumption band pricing ecn sept pm cdt please note change in date time and location,50128,1,0,0,0,1
yo karl sysgen co uk home until jan parents alt contact yo hey karl great to hear from you someday we will talk maybe today not sure if youre still in but im at my desk number is i believe it is the same country code as us but not sure its been bad here at work for the last few weeks and its going to take awhile for things to get better im just hoping it doesnt get any worse it was very dicey for awhile thought ene was going tits up spanish desk sounds great say hi to kristian and paul for me but we should catch up by phone if possible so ill leave it there cooper p s snow is just falling on the mountains and im getting excited for some good skiing yo hey how you doing still hanging in there is the snow on the mountains yet for skiing back in london slowly getting to grips with the changes that have taken place not quite visible at first i am working with paul again on the spanish desk along with kristian and things are a little interesting in the market been limited to plugging things together with excel and not much database creativity more analysis which is good but a bit limiting at times with the internal police preventing flexibility are you in the office today i have a question for you karl,50697,1,0,0,0,1
looks like ill be free for lunch any interest i think we should make a pact not to talk about chicks or at least keep it to a minimum itll be like the smoking thing occasionally but cut back for sure,51462,1,0,0,0,1
happy new year that motherboard does look sweet why the scsi drives though personally i want to find a raid card that can handle raid everything ive seen is or and then link up a bunch of smallish ide drives if the controller is good you dont need super fast and expensive drives so you get speed and redundancy as i look at hardware i cant believe how much enron was paying compaq for hardware its amazing as for parts what do you think about ordering from the cheapest u s source and paying duty coffee or lunch would be great supposed to be big news about the enron auction today but things are very slow and im more or less available any time whenever youre next in town give me a buzz or if youre looking for a reason to come into town how about tuesday or wednesday lunch or an afternoon coffee happy new year we have delayed our trip to france again janet threatened to divorce me if we dont go on a holiday soon but she never follows through with her threats promises promises hardware im in the process of building the ultimate server myself check out the new tyan s motherboard sweeeet this with a couple of amd mp processors and scsi rpm u drives this should be the ultimate hooked on the other end of the pipe to one of the servers at enron it should push back so hard that those old compaqs sream for mercy im shopping for hardware all over really just out of the computer paper and by dropping into a couple of computer stores here and there memory express oa group all have good prices but i can probably get even better prices from a small computer shop out here in cochrane hell order it in for me and i can negotiate with him how was everything back east hope you had a good time and got all caught on rest relaxation and visiting im getting bushed sitting at home learning all the net crap and am always anxious to get out for coffee or lunch let me know if we can catch a coffee sometime greg on wed jan richey cooper wrote hey greg happy new year i cant remember when you were taking your trip to france but i hope things are going well im back in town now after a long and peaceful break mainly just waiting to see what happens to the enron trading operations where did you buy the hardware when you built your servers im thinking of building a database server and am not sure if its best to mail order or buy in person somewhere in town hope youre well and talk to you soon cooper boilerplate disclaimer boilerplate disclaimer this e mail is the property of enron corp and or its relevant affiliate and may contain confidential and privileged material for the sole use of the intended recipient s any review use distribution or disclosure by others is strictly prohibited if you are not the intended recipient or authorized to receive for the recipient please contact the sender or reply to enron corp at enron messaging administration enron com and delete all copies of the message this e mail and any attachments hereto are not intended to be an offer or an acceptance and do not create or evidence a binding and enforceable contract between enron corp or any of its affiliates and the intended recipient or any other party and may not be relied on by anyone as the basis of a contract by estoppel or otherwise thank you boilerplate disclaimer end of disclaimer end of disclaimer,51602,1,0,0,0,1
test i dont see them but i dont have corel installed on my computer it would probably work in a company who installs more software in their computers than just bare bones they even bought systems without cd roms to serve a dual purpose lower costs and minimize those pesky disractions so you can focus all your attention on your work test file ole bmp file ole bmp hey do you see graphics above this sentence the admins showed me how to insert clip art into email and im trying to figure out if works outside of enron boilerplate disclaimer boilerplate disclaimer this e mail is the property of enron corp and or its relevant affiliate and may contain confidential and privileged material for the sole use of the intended recipient s any review use distribution or disclosure by others is strictly prohibited if you are not the intended recipient or authorized to receive for the recipient please contact the sender or reply to enron corp at enron messaging administration enron com and delete all copies of the message this e mail and any attachments hereto are not intended to be an offer or an acceptance and do not create or evidence a binding and enforceable contract between enron corp or any of its affiliates and the intended recipient or any other party and may not be relied on by anyone as the basis of a contract by estoppel or otherwise thank you boilerplate disclaimer end of disclaimer end of disclaimer,51820,1,0,0,0,1
important announcement regarding document preservation on wednesday october i sent an email to all enron employees worldwide in order to ensure that enron employees retained documents that might be relevant to ongoing litigation new lawsuits have been filed that enlarge the scope of the information that enron will need to retain the following list includes both the topics in the earlier email and the topics related to the new lawsuits effective immediately please do the following if you have any voice mails that relate in any way to the ljm deal or chewco investments l p including any accounting issues related to these transactions please forward the voice mails to x if you have any voice mails that relate in any way to the proposed dynegy merger or the enron corp savings plan including any accounting issues related to these transactions please forward the voice mails to x if you have any voice mails that relate in any way to enrons public statements regarding ebs azurix new power co or any voice mail regarding financial transactions involving these matters including accounting issues related to these matters please forward the voice mails to x if you have any voice mails that relate in any way to enrons public statements regarding the proposed merger with dynegy or the enron corp savings plan or any voice mail regarding financial transactions involving these matters including accounting issues related to these matters please forward the voice mails to x if you have any e mails that relate in any way to the ljm deal chewco investments l p including any accounting issues related to these transactions please forward the e mails to ljm litigation enron com if you have any e mails that relate in any way to the proposed dynegy merger including any accounting issues related to these transactions please forward the e mails to dynegy merger enron com if you have any e mails that relate in any way to the enron corp savings plan including any accounting issues related to these transactions please forward the e mails to enron savingsplan enron com if you have any e mails that relate in any way to enrons public statements regarding ebs azurix new power co or any e mail regarding financial transactions involving these matters including accounting issues related to these matters please forward the e mails to classaction litigation enron com if you have any e mails that relate in any way to enrons public statements regarding the proposed dynegy merger or any e mail regarding financial transactions involving these matters including accounting issues related to these matters please forward the e mails to dynegy merger enron com if you have any e mails that relate in any way to enrons public statements regarding the enron corp savings plan or any e mail regarding financial transactions involving these matters including accounting issues related to these matters please forward the e mails to enron savingsplan enron com ljm deal includes ljm cayman l p ljm co investment l p tnpc margaux cortez tnpc osprey avici catalytica fishtail pulp paper backbone ena clo merlin nowa sarzyna poland bob west megs yosemite eecc turbines blue dog raptor raptor a raptor raptor a raptor raptor rawhide ljm ww loan agrmt osprey llc rythms osprey cuiaba and ljm cayco investments also please forward all future e mails and voice mails that relate to the above referenced subjects to the appropriate e mail address or voice mail box these procedures will ensure that our electronic documents and voice mails are properly preserved shortly our lawyers will be collecting our traditional files i e written documents for possible production in litigation until further notice please retain all of your hard copy files now in your possession or that come into your possession that in any way relate to the ljm deal azurix new power co ebs chewco investments l p accounting for any enron investments any enron public statement made to the investment public any enron public filing with the sec or other regulatory bodies the proposed merger with dynegy the enron corp savings plan it is not necessary to send documents related to your personal participation in the plan such as plan communications to you regarding the status of your account please err on the side of retention of documents if you have any questions please call andrew edison at x,52320,1,0,0,0,1
ercot market guide this is to announce the publication of the ercot market guide the guide is a comprehensive introduction to the competitive electric market from a non technical viewpoint it is designed for a general audience within your organization to introduce the general concepts of the deregulated market the market participant and their roles and the rules of the competitive wholesale and retail electric market it is our hope that this document will assist you in communicating basic market concepts to the team of people working on the successful launch of your efforts to participate in the ercot market the document is also available for download at the ercot program website the document will be revised periodically to incorporate any changes to market rules and processes and any comments received subsequent revisions will be posted to the program website http www texaschoiceprogram com documentation ma rkpartdocs ercot market guide pdf if you have any questions or would like to provide feedback to the market guide document please call patrick coon at or e mail patrick at pcoon ercot com ercot market guide v p zip ercot market guide v p zip,52626,1,0,0,0,1
