data,index,count,bow,tfidf,lstm,gru
college football odds image image please visit our sponsors free cell phone headset airbags anti lock brakes both hands on the wheel today there are more ways than ever to make your car safer the rest is up to you get a free cell phone headset to keep both hands on the wheel click here dear joe stepo ncaa football tonight favorite open today o u underdog at miami west virginia tomorrow fresno st at hawaii saturday ohio st at penn st at temple pittsburgh clemson at wake forest at virginia tech syracuse vanderbilt at duke at n c state virginia michigan at iowa at wisconsin michigan st at purdue northwestern auburn at arkansas at ohio kent st at e michigan buffalo tulane at army n illinois at cent michigan ball st at connecticut at texas a m iowa st louisville at cincinnati colorado at oklahoma st at kansas st kansas at louisiana tech rice at miami ohio w michigan at middle tenn new mexico st at new mexico air force at southern miss houston idaho at arkansas st texas tech at baylor utah at colorado st at smu utep unlv at wyoming florida georgia x at tennessee south carolina at florida st maryland at nebraska oklahoma at oregon st california at boston college notre dame at san jose st tulsa at la lafayette louisiana monroe at washington st oregon ucf at utah st at arizona st washington at toledo navy at marshall akron texas at missouri ucla at stanford at boise st nevada at lsu mississippi uab at memphis southern cal at arizona byu at san diego st tuesday east carolina at tcu x at jacksonville fla cool new reminders great quotes of the daytravel digestpet tips favorite reminders entertainment newschildrens product recallsu s market indicies receive a weekly e mail with the latest line on ncaa division i basketball games click here to unsubscribe from this reminder topic click here to unsubscribe from smartreminders altogether click here image,181753,1,1,0,0,0
my wife is in new york and will not return until on sunday i am keeping my boys and will work on getting a babysitter in the morning i will call you tomorrow grigsby there will be a desk head mtg tomorrow sunday at on the rd floor per lavorato to discuss positions and strategy please confirm via email my cell is if there are any problems,187230,1,1,0,0,0
messenger antonio i am john griffith i sit next to mike maggi and john arnold my yahoo messenger address is johngriffith send me info whenever you need thanks by the way my phone number is thanks john end of signature end of signature end of signature,190388,1,1,0,0,0
tco capacity update effective for october columbia gas transmission corporation notice to all interested parties october notice id no response required subject capacity update effective for thursday october there are no changes from the previous day effective thursday october capacities will be as follows excess mdwq available iss withdrawals available sit withdrawals available imbalance drawdowns available pal lends unparks available excess mdiq not available iss injections not available sit injections not available imbalance paybacks not available pal parks loan paybacks not available call gas control hours in advance at to request approval non firm receipt capacity will be as follows tennessee brinker b broad run b cambridge b dungannon b highland b note gas received at highland must be delivered in the northern portion of market area or the northwest lateral of market area directly north of highland milford b north greenwood b unionville b note effective thursday august any shipper utilizing a contract that has a primary receipt point s with the following points must utilize these points brinker b cambridge b dungannon b highland b milford b unionville b texas eastern delmont c eagle c hooker c pennsburg c windridge c national fuel independence m ellwood city l transco downingtown e emporia i e rockville e dranesville e algonquin ramapo r anr paulding cecil f a lebanon aggregate a f c d toledo aggregate a f columbia gulf tco leach internal point non firm capacity will be as follows lanham no restrictions delivery capacity non firm will be as follows transco martins creek mli e young womans creek mli e algonquin hanover mli r equitrans fallen timber mli k waynesburg rhinehart mli k opt will be available in all market areas opt will be available in all market areas market area delivery capacity non firm will be as follows operating area market area no restrictions market area no restrictions operating area market area no restrictions operating area market area no restrictions market area no restrictions market area no restrictions market area no restrictions market area no restrictions operating area market area no restrictions market area no restrictions market area no restrictions market area no restrictions market area no restrictions market area no restrictions operating area market area no restrictions market area no restrictions operating area market area no restrictions market area no restrictions market area no restrictions market area no restrictions market area no restrictions operating area market area no restrictions market area no restrictions market area no restrictions market area no restrictions market area no restrictions market area no restrictions market area no restrictions operating area market area no restrictions market area no restrictions market area no restrictions market area no restrictions market area no restrictions market area no restrictions market area no restrictions market area no restrictions note gas delivered in the northern portion of market area or the northern portion of market area must be received from tennessee gas pipeline at highland operating area market area no restrictions market area no restrictions market area no restrictions if you have any questions please contact your account representative,192815,1,1,0,0,0
jhodge omni omninotes omninotes omnipab omnipab omnitodos omnitodos omnicalendarentries omnicalendarentry omnicalendarentryid omnicalendarentryid omnicreateddate am omnicreateddate omnistartdatetime pm omnistartdatetime omnienddatetime pm omnienddatetime omniprincipal cn john hodge ou corp o enron omniprincipal omniexcludefromview d omniexcludefromview omnichair cn john hodge ou corp o enron omnichair omni nopurge pm omni nopurge omni busypriority omni busypriority omni busyname cn john hodge ou corp o enron omni busyname omnicalendardatetime pm omnicalendardatetime omniorgdontdoublebook omniorgdontdoublebook omniorgtable c omniorgtable omnidocauthors cn john hodge ou corp o enron omnidocauthors omnibody omnibody omnifrom cn john hodge ou corp o enron omnifrom omniappointmenttype omniappointmenttype omniduration omniduration omniremindertime pm omniremindertime omnisubject origination staff meeting omnisubject omnistartdate pm omnistartdate omnitimerange pm pm omnitimerange omnibookfreetime omnibookfreetime omniorgconfidential omniorgconfidential omnisendto omnisendto omnicopyto omnicopyto omnibroadcast omnibroadcast omni viewicon omni viewicon omniform appointment omniform omni expandgroups omni expandgroups omni updatedby cn john hodge ou corp o enron omni updatedby omni revisions am omni revisions omnicalendarentry omnicalendarentry omnicalendarentryid omnicalendarentryid omnicreateddate am omnicreateddate omnistartdatetime pm omnistartdatetime omnienddatetime pm omnienddatetime omniprincipal cn john hodge ou corp o enron omniprincipal omniexcludefromview d omniexcludefromview omnichair cn john hodge ou corp o enron omnichair omni nopurge pm omni nopurge omni busypriority omni busypriority omni busyname cn john hodge ou corp o enron omni busyname omnicalendardatetime pm omnicalendardatetime omniorgdontdoublebook omniorgdontdoublebook omniorgtable c omniorgtable omnidocauthors cn john hodge ou corp o enron omnidocauthors omnibody omnibody omnifrom cn john hodge ou corp o enron omnifrom omniappointmenttype omniappointmenttype omniduration omniduration omniremindertime pm omniremindertime omnisubject enron lng omnisubject omnistartdate pm omnistartdate omnitimerange pm pm omnitimerange omnibookfreetime omnibookfreetime omniorgconfidential omniorgconfidential omnisendto omnisendto omnicopyto omnicopyto omnibroadcast omnibroadcast omni viewicon omni viewicon omniform appointment omniform omni expandgroups omni expandgroups omni updatedby cn john hodge ou corp o enron omni updatedby omni revisions am omni revisions omnicalendarentry omnicalendarentry omnicalendarentryid omnicalendarentryid omnicreateddate am omnicreateddate omnistartdatetime pm omnistartdatetime omnienddatetime pm omnienddatetime omniprincipal cn john hodge ou corp o enron omniprincipal omniexcludefromview d omniexcludefromview omnichair cn john hodge ou corp o enron omnichair omni nopurge pm omni nopurge omni busypriority omni busypriority omni busyname cn john hodge ou corp o enron omni busyname omnicalendardatetime pm omnicalendardatetime omniorgdontdoublebook omniorgdontdoublebook omniorgtable c omniorgtable omnidocauthors cn john hodge ou corp o enron omnidocauthors omnibody omnibody omnifrom cn john hodge ou corp o enron omnifrom omniappointmenttype omniappointmenttype omniduration omniduration omniremindertime pm omniremindertime omnisubject origination staff meeting omnisubject omnistartdate pm omnistartdate omnitimerange pm pm omnitimerange omnibookfreetime omnibookfreetime omniorgconfidential omniorgconfidential omnisendto omnisendto omnicopyto omnicopyto omnibroadcast omnibroadcast omni viewicon omni viewicon omniform appointment omniform omni expandgroups omni expandgroups omni updatedby cn john hodge ou corp o enron omni updatedby omni revisions am am omni revisions omnicalendarentry omnicalendarentry omnicalendarentryid omnicalendarentryid omnicreateddate am omnicreateddate omnistartdatetime pm omnistartdatetime omnienddatetime pm omnienddatetime omniprincipal cn john hodge ou corp o enron omniprincipal omniexcludefromview d omniexcludefromview omnichair cn john hodge ou corp o enron omnichair omni nopurge pm omni nopurge omni busypriority omni busypriority omni busyname cn john hodge ou corp o enron omni busyname omnicalendardatetime pm omnicalendardatetime omniorgdontdoublebook omniorgdontdoublebook omniorgtable c omniorgtable omnidocauthors cn john hodge ou corp o enron omnidocauthors omnibody omnibody omnifrom cn john hodge ou corp o enron omnifrom omniappointmenttype omniappointmenttype omniduration omniduration omniremindertime pm omniremindertime omnisubject origination staff meeting omnisubject omnistartdate pm omnistartdate omnitimerange pm pm omnitimerange omnibookfreetime omnibookfreetime omniorgconfidential omniorgconfidential omnisendto omnisendto omnicopyto omnicopyto omnibroadcast omnibroadcast omni viewicon omni viewicon omniform appointment omniform omni expandgroups omni expandgroups omni updatedby cn john hodge ou corp o enron omni updatedby omni revisions am am omni revisions omnicalendarentry omnicalendarentry omnicalendarentryid omnicalendarentryid omnicreateddate am omnicreateddate omnistartdatetime pm omnistartdatetime omnienddatetime pm omnienddatetime omniprincipal cn john hodge ou corp o enron omniprincipal omniexcludefromview d omniexcludefromview omnichair cn john hodge ou corp o enron omnichair omni nopurge pm omni nopurge omni busypriority omni busypriority omni busyname cn john hodge ou corp o enron omni busyname omnicalendardatetime pm omnicalendardatetime omniorgdontdoublebook omniorgdontdoublebook omniorgtable c omniorgtable omnidocauthors cn john hodge ou corp o enron omnidocauthors omnibody omnibody omnifrom cn john hodge ou corp o enron omnifrom omniappointmenttype omniappointmenttype omniduration omniduration omniremindertime pm omniremindertime omnisubject origination staff meeting omnisubject omnistartdate pm omnistartdate omnitimerange pm pm omnitimerange omnibookfreetime omnibookfreetime omniorgconfidential omniorgconfidential omnisendto omnisendto omnicopyto omnicopyto omnibroadcast omnibroadcast omni viewicon omni viewicon omniform appointment omniform omni expandgroups omni expandgroups omni updatedby cn john hodge ou corp o enron omni updatedby omni revisions am am omni revisions omnicalendarentry omnicalendarentry omnicalendarentryid omnicalendarentryid omnicreateddate am omnicreateddate omnistartdatetime pm omnistartdatetime omnienddatetime pm omnienddatetime omniprincipal cn john hodge ou corp o enron omniprincipal omniexcludefromview d omniexcludefromview omnichair cn john hodge ou corp o enron omnichair omni nopurge pm omni nopurge omni busypriority omni busypriority omni busyname cn john hodge ou corp o enron omni busyname omnicalendardatetime pm omnicalendardatetime omniorgdontdoublebook omniorgdontdoublebook omniorgtable c omniorgtable omnidocauthors cn john hodge ou corp o enron omnidocauthors omnibody omnibody omnifrom cn john hodge ou corp o enron omnifrom omniappointmenttype omniappointmenttype omniduration omniduration omniremindertime pm omniremindertime omnisubject origination staff meeting omnisubject omnistartdate pm omnistartdate omnitimerange pm pm omnitimerange omnibookfreetime omnibookfreetime omniorgconfidential omniorgconfidential omnisendto omnisendto omnicopyto omnicopyto omnibroadcast omnibroadcast omni viewicon omni viewicon omniform appointment omniform omni expandgroups omni expandgroups omni updatedby cn john hodge ou corp o enron omni updatedby omni revisions am am omni revisions omnicalendarentry omnicalendarentry omnicalendarentryid omnicalendarentryid omnicreateddate am omnicreateddate omnistartdatetime pm omnistartdatetime omnienddatetime pm omnienddatetime omniprincipal cn john hodge ou corp o enron omniprincipal omniexcludefromview d omniexcludefromview omnichair cn john hodge ou corp o enron omnichair omni nopurge pm omni nopurge omni busypriority omni busypriority omni busyname cn john hodge ou corp o enron omni busyname omnicalendardatetime pm omnicalendardatetime omniorgdontdoublebook omniorgdontdoublebook omniorgtable c omniorgtable omnidocauthors cn john hodge ou corp o enron omnidocauthors omnibody omnibody omnifrom cn john hodge ou corp o enron omnifrom omniappointmenttype omniappointmenttype omniduration omniduration omniremindertime pm omniremindertime omnisubject origination staff meeting omnisubject omnistartdate pm omnistartdate omnitimerange pm pm omnitimerange omnibookfreetime omnibookfreetime omniorgconfidential omniorgconfidential omnisendto omnisendto omnicopyto omnicopyto omnibroadcast omnibroadcast omni viewicon omni viewicon omniform appointment omniform omni expandgroups omni expandgroups omni updatedby cn john hodge ou corp o enron omni updatedby omni revisions am am omni revisions omnicalendarentry omnicalendarentries omni,193541,1,1,0,0,0
emissions positions call me when you get back,194964,1,1,0,0,0
computer eligibility i was wondering why i am not eligible yet i sent gave my agreement forms to tricia henry yesterday,199710,1,1,0,0,0
out of office autoreply i am on holidays from aug aug i will be returning to the office on aug and will attend to my e mail at that time greg mann can be reached at in my absence if immediate assitance is required thanks mark,201631,1,1,0,0,0
i am on five under upstream products hey jean where are you sitting these days,202542,1,1,0,0,0
cfa sponsorship jonathon i would be glad to sponsor you or put you in touch with someone at aimr susan kemp hanna,202843,1,1,0,0,0
power gas books list review here is the list of all power gas books set up in netco production database and please check and let me know asap if there is any missing or incorrect information cp id short name code region commodity uom currency commodity uom curr pwr gas option me nymex ng mmbtu usd ng mmbtu usd pwr gas wmgmt mj nymex ng mmbtu usd ng mmbtu usd deleted pwr gas pjm me nymex ng mmbtu usd ng mmbtu usd pwr gas lt erct me nymex ng mmbtu usd ng mmbtu usd pwr gas se me nymex ng mmbtu usd ng mmbtu usd pwr gas st pjm me nymex ng mmbtu usd ng mmbtu usd pwr gas st erct me nymex ng mmbtu usd ng mmbtu usd pwr gas st ny me nymex ng mmbtu usd ng mmbtu usd pwr gas st mw me nymex ng mmbtu usd ng mmbtu usd pwr gas optb me nymex ng mmbtu usd ng mmbtu usd pwr gas opta me nymex ng mmbtu usd ng mmbtu usd pwr gas st se me nymex ng mmbtu usd ng mmbtu usd pwr gas nw mj nymex ng mmbtu usd ng mmbtu usd pwr gas sw mj nymex ng mmbtu usd ng mmbtu usd pwr gas cali mj nymex ng mmbtu usd ng mmbtu usd pwr gas mgmt me nymex ng mmbtu usd ng mmbtu usd pwr gas ne me nymex ng mmbtu usd ng mmbtu usd pwr gas mw me nymex ng mmbtu usd ng mmbtu usd pwr gas ercot me nymex ng mmbtu usd ng mmbtu usd thanks cecilia x,206350,1,1,0,0,0
power gas books list review looks complete thanks for your help power gas books list review here is the list of all power gas books set up in netco production database and please check and let me know asap if there is any missing or incorrect information cp id short name code region commodity uom currency commodity uom curr pwr gas option me nymex ng mmbtu usd ng mmbtu usd pwr gas wmgmt mj nymex ng mmbtu usd ng mmbtu usd deleted pwr gas pjm me nymex ng mmbtu usd ng mmbtu usd pwr gas lt erct me nymex ng mmbtu usd ng mmbtu usd pwr gas se me nymex ng mmbtu usd ng mmbtu usd pwr gas st pjm me nymex ng mmbtu usd ng mmbtu usd pwr gas st erct me nymex ng mmbtu usd ng mmbtu usd pwr gas st ny me nymex ng mmbtu usd ng mmbtu usd pwr gas st mw me nymex ng mmbtu usd ng mmbtu usd pwr gas optb me nymex ng mmbtu usd ng mmbtu usd pwr gas opta me nymex ng mmbtu usd ng mmbtu usd pwr gas st se me nymex ng mmbtu usd ng mmbtu usd pwr gas nw mj nymex ng mmbtu usd ng mmbtu usd pwr gas sw mj nymex ng mmbtu usd ng mmbtu usd pwr gas cali mj nymex ng mmbtu usd ng mmbtu usd pwr gas mgmt me nymex ng mmbtu usd ng mmbtu usd pwr gas ne me nymex ng mmbtu usd ng mmbtu usd pwr gas mw me nymex ng mmbtu usd ng mmbtu usd pwr gas ercot me nymex ng mmbtu usd ng mmbtu usd thanks cecilia x,206353,1,1,0,0,0
why should men have all the fun why should men have all the fun let me introduce you to vigel a topical gel that increases feminine sexual pleasure and excitement click here to find out more about vigel remove yourself from this list by either entering your email address below and clicking remove or reply to this message with the word remove in the subject line this message was sent to address andrew h lewis enron com pmguid k mwy edkxk pmg,12718,1,0,1,0,0
baseball and the irishman arkansas joke guy is driving down a rural road in arkansas cop pulls him over and asks got any id guy replies bout what nother one the toothbrush must have been invented in arkansas otherwise it would have been called the teethbrush,18391,1,0,1,0,0
i think its spelled gaetien and i would like to see those guys so count me in if it happens,18649,1,0,1,0,0
eweb guys heres what we sent eweb,20160,1,0,1,0,0
please respond before cob wednesday ena ees comments in rp attached is the draft of ena ees comments to be filed thursday in the proceeding on the complaint filed by various producers the cpuc socal gas and socal edison against el paso natural gas alleging that el paso has oversold its system and that full requirements contracts should be converted to cd our comments agree with the complainants illustrated by ees experiences with southwest gas this past winter if you have any comments or questions about this filing please let me or leslie know by close of business pm cdt tomorrow,20359,1,0,1,0,0
celebrity quotes and theres no truth to the rumor that these es came from marc stewart women might be able to fake orgasms but men can fake whole relationships sharon stone honesty is the key to a relationship if you can fake that youre in courtney cox monica on friends i read somewhere that per cent of all the mentally ill live in poverty actually im more intrigued by the per cent who are apparently doing quite well for themselves jerry garcia grateful dead clinton lied a man might forget where he parks or where he lives but he never forgets oral sex no matter how bad it is barbara bush former us first lady ah yes divorce from the latin word meaning to rip out a mans genitals through his wallet robin williams women need a reason to have sex men just need a place billy crystal instead of getting married again im going to find a woman i dont like and just give her a house rod stewart on the one hand well never experience childbirth on the other hand we can open all our own jars bruce willis on the difference between men and women and god said let there be satan so people dont blame everything on me and let there be lawyers so people dont blame everything on satan george burns my girlfriend always laughs during sex no matter what shes reading steve jobs founder apple computers hockey is a sport for white men basketball is a sport for black men golf is a sport for white men dressed like black pimps tiger woods capital punishment turns the state into a murderer but imprisonment turns the state into a gay dungeon master rev jesse jackson my mother never saw the irony in calling me a son of a bitch jack nicholson women complain about premenstrual syndrome but i think of it as the only time of the month that i can be myself roseanne according to a new survey women say they feel more comfortable undressing in front of men than they do undressing in front of other women they say that women are too judgmental whereas of course men are just grateful robert de niro in the last couple of weeks i have seen the ads for the wonder bra is that really a problem in this country men not paying enough attention to womens breasts hugh grant theres a new medical crisis doctors are reporting that many men are having allergic reactions to latex condoms they say they cause severe swelling so whats the problem dustin hoffman when the sun comes up i have morals again elizabeth taylor theres very little advice in mens magazines because men think i know what im doing just show me somebody naked jerry seinfield and the number one quote is see the problem is that god gives men a brain and a penis and only enough blood to run one at a time robin williams,20775,1,0,1,0,0
beer stand if you dont have a broadband connection this will probably take too long for everyone else its worth the wait and its clean see attached file the man show boy beer stand wmv,20848,1,0,1,0,0
never complain about what you dont have i think there was an ac dc song about this guy testicles mpg,21721,1,0,1,0,0
genco meeting the meeting has been switched to pm over near room tba let me know if this doesnt work for any of you thanks ben,23417,1,0,1,0,0
i wonder why now you guys can be in the drivens seat with regards to them ben,25335,1,0,1,0,0
so you were looking for a one night stand afterall dc,27540,1,0,1,0,0
message those boys have wads of cash on hand i am sure they will pay you handsomely regardless of your decision message thats still true i was getting worried about chapter x filings a friend in b school worked at arco when bp bought them she got a yr package where do i sign up message yes i did from what you mentioned it seemed as if we are a potential take over targe message did you get the message last night that the banks pulled it out for us,28851,1,0,1,0,0
wireless message fwd fwd fwd r at airport cant wait to get home talking to an old man sitting next to us is going to s a graduated from brackenridge in o his wife went to alamo heights small world,29723,1,0,1,0,0
i am leaving for home now hi sweetheart the trip and all really took it out of me i am taking off for home now looking at a little nap action and then if i feel good start packing i love you and will see you this after noon dont work my man too hard but i will rub your feet when you get home if you do love cf,30248,1,0,1,0,0
want to hear about a bad day down million usd today temps came in degress hotter than we thought in the northeast this week and blew up chris sounds good man we should maybe talk on the weekend i think a mid sept tee time will work i want to try to be there for the off site with the west guys tell john z ill call him this afternoon chris,38127,1,0,1,0,0
mike can you light a fire under the phone guys in houston to look into fixing our line ill talk to our guy and get his gas in gear chris,38332,1,0,1,0,0
word thanx ill give you a shout later word chris just wondering if things are cool give me a shout if you are heading into toronto or if you want to get in touch with anyone down here cheers secko,38479,1,0,1,0,0
dont forget about oconnors chick,38602,1,0,1,0,0
stampede festivities are you guys still going to desperados sp tommorow i think im going to head there at about pm with rob laird and blair mcdermott you know blair the guy with the huge w b chris,39559,1,0,1,0,0
proposition looks like what i thought was happening is happening give me a call chris,39663,1,0,1,0,0
this is my beautiful transport worksheet for uncle frenchy what do you think,42252,1,0,1,0,0
boss a boss and two of his employees are on their way to a meeting walking through a park they find a miracle lamp they rub it and suddenly a genie appears the genie says normally the one who frees me has three wishes free now you are three persons so everyone of you has one wish the first employee yells me first me first and expresses his wish i would like to be on the bahamas on a very fast yacht and have no more worries and pfffffff he is away now the second employee yells me next me next and he expresses his wish i would like to be in the caribbean along with the prettiest girls of the world and an inexhaustible source of exotic cocktails and pfffffff he is away and what is your wish the genie asks the boss and the boss replies i want these two idiots to be back in office after lunch and the moral of this story always let your boss speak first,42926,1,0,1,0,0
estimates for may hey guys please update the volumes for by april tuesday pm thanks joann,45673,1,0,1,0,0
