data,index,count,bow,tfidf,lstm,gru
in re f j representation bob and i just spoke with steve susman i tried to mention the points you asked here are his comments f j probably could not simply send us our files back and put itself in a position to be adverse to us with arthur anderson susman believes that there is a hot potato rule that prevents f j from doing so that being said susman doesnt care if f j represents arthur anderson or anyone else potentially adverse to us in the actions he is handling susman would not however agree to a broad advance ethical waiver as proposed by f j he does not believe such waivers are effective susman would agree to a waiver once we were advised who f j wanted to represent i dont know whether f j would agree to this or not susman recognizes that we cannot force f j to take on the new mariner matter and that this is ultimately a risk benefit decision for us to make and that we may have to agree to terms that we otherwise wouldnt agree to parenthetically i have received no comments on f js proposed waiver letter under the circumstances from his standpoint bob is inclined for us to get the best deal on the waiver letter that we can with f j but that if f j wont budge that we take something along the lines of what they have given us bob let me know if i have mischaracterized your thoughts from my standpoint i unfortunately think there are some parts of the letter that we must have changed this would be to the extent that the letter purports to have enron corp agree to bind all the enron entities and to the extent that it involves enrons agreement to what will happen after the dynegy merger as i set out in my earlier e mail my recommendation would be as set forth in my earlier e mail that only the enron entities currently being represented by f j sign it and be bound by it and to remove the language regarding what enron would agree to after the dynegy merger i also find the advance ethical waiver language repugnant but could agree to it if the other modifications mentioned could be made i do not know whether f j would be willing to make these changes or not our biggest problem right now is time management i know that mariner wanted to make a decision by today as to who to use i am willing to confer with dutton asap to see what f j would agree to and if he can agree in principle to send him a proposed draft agreement i believe he is out of the office but is checking his voice mail please let me know what you want me to do britt,144724,1,0,0,0,1
possible press release before market open on attached are two versions of a press release we plan to issue one of these before market open tomorrow the second version assumes financial close on the remainder of the secured credit facility i need someone to confirm or deny the first version speaks only to the merger and our debt restructuring efforts please review and provide comments as soon as possible to me and karen denne karen denne enron com i understand that jeff mcmahon and jimmy lee will discuss the attached at cst tomorrow,144789,1,0,0,0,1
icap fine i still think that any obligation is a mistake just improving a bad market is not going to help make sure that dan allegretti is in the loop nepool is putting something like this together jim icap i know anyway the single most important issue from the perspective of retail seems to be daily granularity we need to be able to adjust our daily obligation based on customer switching patterns these can occur at any time so any thing that locks in our capacity requirement for a long period of time months to a year or more can be a killer a specific model we discussed was operating capacity this takes the operating reserves concept and blows it up to a full capacity market equivalent iso administers the market generators commit capacity to energy market or reserve market but not both long term deals possible as well as real time market lots has to be flushed out but it seems like a viable approach will discuss more on wednesday have talked briefly with luiz about this icap harry enron can never take the position that icap is good i dont know why stoness is trying to undertake more analysis his reasoning that icap is complicated and we do well at complications is crazy given the ees business model enron direct let me know how it is going jim icap kingerski harry we can meet today at pm in room to discuss more about retails view of icap and related issues scott stoness summary of our meeting yesterday with dale furrow his regional leads and narsimha misra the gist of the meetings was pro icap was pragmatically high energy costs are bad because they delay competition icap is therefore good because it reduces the high price periods with market intervention pragmatically icap is complicated and complicated translucent rules favor the bright enron mathematically separate markets capacity and energy should result in the same outcome ie energy costs should reduce to exactly offset the increase in demand charges theorectically if the market expects the government to intervene in the event of high power costs suppliers will build less capacity than needed given that this is inevitable government intervention we might as well intervene now as later theorectically market failure is probable because small customers are not able to internalize the costs of not hedging causing them to take more risk than they should given that the customers are not making the right societal decision we should make it for them pro not icap was any artificial price determination will distort the market causing inefficiencies ie a fixed icap for months will favor a technology available all year round ie icap could cause environmental damage by causing cts to be built instead of combined cycle icap with market is complicated which will decrease market efficiencies market prices with financial firm obligations will result in a continuous balance of supply and demand market prices will result in much more efficiency because they cause more demand side response conclusion there was no consensus there seemed to be more people on the no icap side than the icap side basically comes down to i economics suggests icap is inefficient vs ii lack of icap will damage competition we agreed that if icap is inevitable we should advocate market determined icaps we agreed that given that this issue is controversial and that narshima has the largest interests he should head up our response scott,146248,1,0,0,0,1
hi jim i have a favor to ask sorry that i didnt get to you sooner the head of the group is tim battaglia who is the best person to work with jim hi jim i have a favor to ask hey jim thanks for your note back glad to hear that you all are well and hope you had a nice vacation in the meanwhile roger has actually had a chance to go in and interview with enron he was there for half a day last saturday talking with the steel group it seemed to go really well and he will be going in to talk to them again on thursday roger is pretty excited about what they are doing so hopefully something will work out well ill keep you posted and once we make it back to houston well have to get together some time take care lisa,146299,1,0,0,0,1
pge imbalance charge think the best thing is to let it ride no sense in discussing because we dont have a solution for them see if any intelligence on how hard they are going to push npco to fight us jim pge imbalance charge im going to carson city tomorrow i thought i could present the following message to the commissioners contracts were negotiated in a bilateral market at arms length nobody was requiring npco to do business with us similar contracts were upheld by the alj in the pnw refunds case youre going to completely screw up forward markets and npcos ability to contract in the future think of the risk premium that will attach to future contracts we tried to be the good guy with npco by offering a more comprehensive solution for them numerous times now were getting attacked for their mistakes we have met with npco a number of times to try and resolve this issue but the resolution requires that they post collateral now they wont even talk with us the only way you pucn are going to fix this is if you step up and require the utilities to post collateral when necessary however after talking with steve hall i concluded that it would be unwise at this point for me to contact the commissioners we dont have anything to offer and very little new to say for example according to steve we wont touch a blend and extend because of credit problems this said he was uncomfortable saying that the entire issue was collateral pge imbalance charge trying to put something together jim pge imbalance charge always by the way did you have further thoughts about a call to develop a comprehensive nevada strategy pge imbalance charge are we still friends pge imbalance charge thanks i hate it when i sound petulant pge imbalance charge my fault for not making it clear that you should have been in the loop we will send out a message across the board to help with this jim pge imbalance charge this is going to sound like empire building but i need to know what were doing with pge i dont need to participate in the calls but i do need to know the pge folks need to have confidence that im aware of our positions and plans pge imbalance charge we are having a conference call tomorrow with pge they did not decide anything on the last conference call after i told them why enron retail in the east likes the duquense type imbalance no bandwidth thus no penalties imbalances settle at verifiable system lambda john malowney of epmi west desk likes the bandwidth but we are discussing it further since it has created problems for the east ees desk due to the penalties associated with being outside the bandwidth john likes the pge proposal to settle at an index price but pge is reconsidering that aspect unfortunately i dont know of any tps that allow a bandwidth without penalties let me know if you want to participate in the call pge imbalance charge christi whats the latest on the pge imbalance method jim,146468,1,0,0,0,1
credit worthiness particiaption requirements isos amr can we use cash as collateral for pjm jim credit worthiness particiaption requirements isos kindly find a memorandum summarizing the credit worthiness parameters in the functioning isos in the us and canada that was prepared by the risk analytics group ercot is still outstanding and shall send you an update as soon as it is ready the seminal documents in hard copies for this summary are also available at your request please let me know if you have any question brgrds ai file isos credit policyi doc,146629,1,0,0,0,1
michigan status re qfs the tough question may be taking a long term cash committment and transforming it into a single npv payment discount rate issues assuming that is part of the options jim michigan status re qfs rick as discussed here is a brief updated status of the michigan regulatory status as it pertains to qfs in the state in the debates over pa we won several key points pertaining to ofs and agreements with utilities as you also know the retail market will open and mpsc decisions are expected within the next two weeks or so i have not covered the retail market because the previous status did not focus on that market segment if i can be of further help please let me know file michregstatus doc,146658,1,0,0,0,1
pjm nepool nyiso fyi call if you need anything jim pjm nepool nyiso with the cancellation of a number of surety bonds by our providers we are faced with a potential credit crunch in nepool also it is my understanding although i havent seen anything that our nov bills are due in all of the markets on dec christi and i are trying to work out our payment plans if any and other requirements to keep our books afloat we need to have support on understanding any payment obligations and bills if we have them and issues e g annual fees who can we talk with for each market thanks jim,146907,1,0,0,0,1
con ed con ed has now sent a letter i have a copy i can provide that says we have days to remit any monies customers have paid to us and that we have not paid to con ed or they will go to dual billing they said the last payment we made was assuming that check does not get returned to them i thought i remembered mary lynne saying she thought these were all behind avista but i could be wrong if they are is this being handled directly with customers if not how does the con ed process work do they send us multiple bills we consolidate how do we determine which ones the customers have paid us for on mary lynnes a p file i see a couple of items owing to con ed is there any protection from the court for pre petition wade con ed wade as soon as con ed received the wire the next comment back was that they have not received any payment from us for the delivery portion of our customers bills since nov and they were very concerned about this this is what i forwarded along to evan who kicked it to you harry kingerski,147155,1,0,0,0,1
merry christmas and happy new year dear friends as has been my custom for the last several years since my moving from new yorkto californiai am sending a message wishing each and every one of you and your families the happiest and healthiest of holiday seasons this year perhaps more than ever i have had the chance to think about how fortunate i have been to be able to send a greeting out to so many people with whom i have had the opportunity to work with and call my friends over the years from the old nypp to abb apx and enron it has been my pleasure to have worked with you no matter where i have gone i have been lucky enough to met and work with some of the best people in the industry my hope for each of you is to have a prosperous new year and that i have the opportunity to see you again as time moves forward happy holidays dave david f perrino greenview place los altos ca home cell,147167,1,0,0,0,1
additional bankruptcy filings please note the following correction enron energy solutions inc should be enron energy information solutions inc additional bankruptcy filings the following entities filed for bankruptcy late or early tenant services inc enron federal solutions inc enron energy solutions inc enron merchant investments inc please circulate further if i have missed anyone,147229,1,0,0,0,1
nyiso letter of guarantee jim harry i want to make sure this has hit your radar screen please contact juan if you think we can be of any help in resolving this as i understand it they have given us until the end of the week thanks rogers end of signature nyiso letter of guarantee rogers i just had a conversation with mike mackles phil gootee with nyisos credit department regarding advise on updating our letter of guarantee and i learned that they have already talked to enron corps credit department bill bradford and tracy ngo nyiso advised me to contact our credit department for details of their conversation the overview that nyiso did give me was that our letter of guarantee needs to be replaced by the end of this week due to our downgrade of credit rating we had million of credit with nyiso million for energy and for icap that number will change significantly as our physical load increases within the next couple of months let us stay ontop of this issue for it has significant impact on our business juan,147550,1,0,0,0,1
ctc stat eeso tim see my response below ctc stat eeso mary lynne thanks for the numbers it is exactly the information that i was hoping for i ran some quick totals on the data here is what i saw for the commercial customers mwh delivered for commercial during this time period total positive ctc owed to utility of average ctc for these customers of mwh ruffer mary lynne i provided rate class if you want to see it by rate class without opining on whether we owe these or not i still need to figure out whether theyve been booked and if so how and as more come in we need to figure out what to do with them a few accounting booking questions have these been booked as a payable to pg e ruffer mary lynne yes these are being booked as payables with pg e do we think that they can be offset against any negative ctcs that pg e owes us ruffer mary lynne enrons intent is to fight this through an invoice dispute process with the cpuc basically stating that the credit balances on these customer accounts should be put back on the utility bills and therefore we do not owe this money as well as through the bankrupcy process through recoupment the pg e bankrupcy attorneys asked that enron hold off for hours in the dispute process to discuss this issue i have not heard the outcome of these discussions but jim may have heard is there a clean process in place for tracking and booking these ruffer mary lynne we are requesting the data from operations for this purpose can we do a flash vs actual on these volumes for the time period ruffer mary lynne i do not know what percentage of the da bills we have received of customers that have been dasrd to have a feel for whether we have enough data for this comparison i will work with operations and steve swain to see what they think we can do who has the schedule of historic negative ctc receivalbles and what the accounting treatment has been ruffer mary lynne i will try to get this to you today the accounting treatment was that we booked it as part of our net receivable with pg e and sce and took the income i think we need to prepare a one stop shopping binder or folder with all of the positive and negative ctc information going back through time perhaps this has been done already but i havent seen it ruffer mary lynne unless operations has this information i have not seen it i will call to discuss the specific information you are trying to capture a couple other questions observations steve do we have any idea how they calculate this in september we will receive charges of approximately million applying our load against a mwh ctc jim what is our process at the cpuc to dispute these charges and clarify pg es methodology i need to get a handle on this asap ctc stat eeso attached is the ctc file for stat eeso it is basically the same as the last file i send with eemc data except that we pulled in the residential commercial indicator so i could split residential out file stat ctc xls,148410,1,0,0,0,1
eon in the us next steps if you want to talk about the ky issues probably best to get with janine migden jim eon in the us next steps tom just to recap what we discussed to make sure i understand next steps you have asked counsel from akin gump to analyse the possible options we may have to intervene at a the federal regulatory level in the eon take overs possible avenues are the ferc and the sec i understand that you and she will also carefully examine any options we mave via the ustr which may prove to be our strongest hand she will provide you with an assessment of the various options and risks to these options in the course of the next week or so as you know andreas and i have spoken to steffes shapiro and frevert all of whom were supportive of this idea and so no marked risk to our relationship with eon or possible akin gump will also file an intervention on our behalf with the ferc re the eon acquisition of lg e by no later than cob monday to provide us with a place holder in the proceedings should we wish to act we will jointly contact shaw on monday to let him know that this is being done building from our meetings in washington russ kean from kissinger and associations will draft up an initial political leverage program which would cover the following what goals we might realistically achieve by engaging senior us politicians in the issue of energy market opening in germany and equal treatment for american companies what key messages would we want to develop to generate high level political interest in this what politicians and decision makers should we want to approach how should the messages be presented and how can we galvanise political action possible targets would be the us trade rep the white house vp cheney key members of congress us assistant secretaries at state and possibly commerce and local politicians in kentucky you and i can then pull this material together into a coherent presentation for eric and other senior folk in london to present the program of how in a graduated fashion we can apply increasing pressure on eon to seek their co operation and or acquiesance in regulatory areas such as unbundling regulated tpa and reciprocity as well as commercial issues such as tolling agreements and long term interconnector capacity mark frevert has offered to raise any of this with harig head of eon if and when we want on a parallel path we will continiue to get the message out that the german market is not open and us firms are suffering when john meets with the congressional delegation in berlin next week and a meeting slated with the new us ambassador coates in berlin later in september missing items do we have interest in also developing a pr angle to this program it may be a bit premature but if so we would need to work with enrons pr agency to develop the messages we would want to get out the vehicles for doing so the localities to hit and the follow up we still need more detail from shaw thompson and radmacher on exactly what their commercial priorities are and how to balance these with regulatory objectives an assessment for options at the state regulatory level have meetings yet been set up with ustr this is a key pressure point let me know what other thoughts you may have and lets talk tomorrow afternoon thanks paul,148637,1,0,0,0,1
potential action against cpuc retroactive suspension of da ive asked sue mara to try and develop through arem some form of legal action that the industry could file if the cpuc goes through with its current plans to retroactively suspend da as of july our goal should be to file tomorrow evening assuming cpuc action to make sure that we are on board it probably makes sense to have a phone call to discuss the draft sometime tomorrow early afternoon pm pst i will leave it to sue mara to arrange with the people on this e mail a conference call to discuss the draft my choice would be to not have enron file the paper but rather work through arem thanks jim,149190,1,0,0,0,1
it sounds better on fm you can pick up the wonderful vocals didnt hear too much from rush on the drive he was probably in a bunker worried that the taliban was after him jim i too enjoy listening to hillbilly tunes but only on am radio when i am not listening to rush,149271,1,0,0,0,1
interested in the admin assist position thanks for the reply we will be reviewing the applications in due course probably best to work through the standard process interested in the admin assist position mr steffes my name is latosha edwards and i am showing a great interest in a position held in your department the position is titled admin assist job i more than just qualify for this job i know this job is for me at this time i am currently working on the st floor as an assistant my asignment will end on the st please respond to this e mail for i would really like the opportunity to set the atmosphere within the office serious about making a future here at enron i have only my best to offer allow me the chance to speak with you we can first start with getting my resume to you i will look for a response soon thank you,149314,1,0,0,0,1
