data,index,count,bow,tfidf,lstm,gru
calpine letter response to please review and give me your comments,59192,4,1,1,1,1
futures and options topics dutch quigley team here are my comments on futures very minor comments,107123,4,1,1,1,1
revised pge ca stephanie attached is a redline with my comments,124733,4,1,1,1,1
filing form keith my changes are redlined please provide any comments,125180,4,1,1,1,1
where are you woman call me,179534,4,1,1,1,1
dinner tonite birthday boy,184873,4,1,1,1,1
golf sat guys as discussed i am going to be tight on time tommorrow as such i am going to take my own car up and would suggest you two carpool together i am leaving houston at am and need to be back by thanks bt,19981,3,1,1,1,0
another man show boy ill send the beer boy but i dont have your home email,20983,3,1,1,1,0
hey whats going on i am heading to dc this weekend with verrechio introducing him to a friend of the girl i am dating should i kiss my relationship goodbye now or wait for verrechio to do that for me gioffre get your private free email at http www hotmail com,21461,3,1,1,1,0
proposition we should grab some sushi and talk call me at work chris,39655,3,1,1,1,0
revised tco secondary point priority allocation columbia gas transmission corporation notice to all interested parties november notice id no response required subject secondary point priority allocation following is the current secondary point priority allocation methodology please contact your customer services represesentative or account manager with any questions operating area market area market areas market area market areas operating area market area market areas operating area market areas none operating area market area market areas market area market areas market area market areas market area market areas market area market areas market area market areas operating area market area market areas market area market area operating area market areas none operating area market areas none operating area market area market areas market area market areas market area market area market area market area market areas market area market area none operating area market area market areas market area market areas market area market areas the points available on a secondary priority basis are subject to change due to system operations or flexibility considerations,47681,3,1,1,1,0
jake tech gif pm jpg pm jpg pm exe,69695,3,1,1,1,0
jake tech gif pm jpg pm jpg pm exe,71202,3,1,1,1,0
jake tech gif pm jpg pm jpg pm exe,71372,3,1,1,1,0
phone numbers jeremy my pager number is my home phone is please call me when the migration is finished,120004,3,1,1,1,0
revised schedules shonnie attached are my comments per our discussion,124621,3,1,1,1,0
comments to guaranty attached are my comments to the guaranty form for torch energy advisors incorporated you forwarded for bridgeline gas marketing llc please review you can contact me at with any questions thanks,124691,3,1,1,1,0
oneok guaranty rudwell attached are my comments to oneoks form of guaranty,124772,3,1,1,1,0
revised schedules shonnie attached are my comments per our discussion,128462,3,1,1,1,0
flights i am booked currently on the following flights to no leaving houston flight at pm leaving new orleans flight at pm,129436,3,1,0,1,1
kristi called me last night tell her that i will buy her all the beer she wants if she goes to cozumel with us just two conditions craig stays home and she rooms with me,129570,3,1,0,1,1
comments needed shelly smith your comments are needed for shelly smith who sat in for pat radford please return as soon as possible thank you becky excellent above average average below average poor initiative cooperation punctuality attendance quality of work would you request this person again y n comments,134253,3,1,1,0,1
fridays visit i will be in the office all week let me know when you guys would like to stop by hunter,141730,3,1,1,1,0
ok so i didnt really think youd be at the office at pm when i left you a message last night buy my day turned into a freak show later jeff,158961,3,1,1,1,0
fyi when are comments due,167376,3,1,1,1,0
status of comments re gov davis dan marty we got together kingerski dasovich black curry smith and discussed the ees presentation jeff indicated that he is incorporating many inputs from many different places but the presentation agrees with what he has in his most recent draft jeff dasovich is going to cc the final draft at pm pst today for more comments with are target of sending on to governor at pm this evening if you have any further comments send them to me and i will incorporate them in comments to jeff scott,171106,3,1,1,0,1
night of men men wanting to man off needing to man off are we still planning on being with men on thursday only men need to respond piggy,176614,3,1,1,1,0
man night final plans men the final descision on the night of men will be as follows where tonys mexican bring your own clown and accessories please when thursday at pm we will wait until zander is able to attend to try the tampico place would rather go w someone who knows the drill i am very much looking forward to seeing all of you men pig n a stinky blanket,176618,3,1,1,1,0
man night men hunting season is over it is now working season all email threads are gone no one talks to one another this is wrong i therefor propose man night february th at some location yet to be determined such as tonys mexican food on ella e chat with friends online try msn messenger http messenger msn com,176984,3,1,1,1,0
dating someone new you make me so jealous dating someone new heres a pic of my new boyfriend what do you think of him my guy jpg file my guy jpg,186812,3,1,1,1,0
does my boy marc findsen have a chance,187082,3,1,1,1,0
move expenses see attachment jackie boy moveexpense doc,188603,3,1,1,1,0
come on you are always sexy sorry not feeling too sexy right now what is going on send me an exciting sexy email to wake me up,190761,3,1,1,1,0
golf sat guys as discussed i am going to be tight on time tommorrow as such i am going to take my own car up and would suggest you two carpool together i am leaving houston at am and need to be back by thanks bt,202518,3,1,1,1,0
you go girl,119813,3,0,1,1,1
man night final plans yes according to chets co worker man night final plans is thursday night man night for those kinds of men too man night final plans so your proposing we are going to the stabbing cabin go to tampico man night final plans men the final descision on the night of men will be as follows where tonys mexican bring your own clown and accessories please when thursday at pm we will wait until zander is able to attend to try the tampico place would rather go w someone who knows the drill i am very much looking forward to seeing all of you men pig n a stinky blanket boilerplate disclaimer boilerplate disclaimer this e mail is the property of enron corp and or its relevant affiliate and may contain confidential and privileged material for the sole use of the intended recipient s any review use distribution or disclosure by others is strictly prohibited if you are not the intended recipient or authorized to receive for the recipient please contact the sender or reply to enron corp at enron messaging administration enron com and delete all copies of the message this e mail and any attachments hereto are not intended to be an offer or an acceptance and do not create or evidence a binding and enforceable contract between enron corp or any of its affiliates and the intended recipient or any other party and may not be relied on by anyone as the basis of a contract by estoppel or otherwise thank you boilerplate disclaimer,177434,3,0,1,1,1
i dont know why but at first it felt a little awkward yesterday when we were going into my house it felt as though i was sneaking a boy into my room i hope i didnt make you feel uncomfortable i was so happy that you came by and that i was able to see you and hold you comfortably at last i guess i didnt really know how to react b c my roommates were home dont get me wrong they are really awesome people they dont care who comes over i think it has been quite a while since i brought male company over though they probably would have been excited for me i think it was just me who was feeling strange i am really really close to my cousin shelly but i dont really want her to know what is going on between us i guess i still feel somewhat awkward with you being married and all and then being at my house and with things progressing as they are between us i just feel strange like this feels right but it is not right i really enjoy being with you but i guess id be much more at ease if you were not attached i am sorry to mention this all over again i know it is the last thing you need to hear on a monday morning i dont know what your plans are and you probably dont know what your plans for the future are as your marriage is concerned and you dont need to answer me i am not asking for an answer or explanation just venting i guess i hope you understand where i am coming from do you ever experience this this odd feeling that i am experiencing i dont know maybe i dont know what i am talking about maybe b c my little friend is visiting i tend to be a little more sensitive than usual i feel so uncomfortable today maybe that is more info than you need to know right now sorry i guess its a female thing well i hope that the rest of your day goes well hey what is going on how did you sleep last nite i didnt sleep well i had weird dreams anyway i had a wonderful time yesterday i hope you did as well you have a very nice room everything a person needs a nice soft bed a tv a closet a computer and a nice soft bed oh did i mention that already i guess that is on my mind have a wonderful day and i will talk to you soon i might need a ride today are you still okay with that i have to call the dealership when they open thank you for offering,190861,3,0,1,1,1
my evening was fine just watched a little tv then went to sleep before pm it was nice to get that much sleep i feel really good today i would have loved to been at foleys with you last nite sounds like a lot of fun hello how are you i had a good time last night it was fun they had some interesting drinks there and good food how was your evening good morning how are you this morning you look good as usual did you have a good time last nite i missed being with you this morning it is a nice way to start the day i hope that everything works out with us i dont want to put you in a bad situation i care about you too much have a great day and i will talk email you soon,191123,3,0,1,1,1
riddle i received your riddle from amy yueh and my answer is nothing let me know if i am right andy,1674,2,1,0,0,1
dm my itinerary is as follows friday november departure houston iah pm arrival tulsa pm flight monday november departure tulsa am arrival houston iah am not that you care if you need to reach me after i land my cell phone number is looking forward to seeing you guys andy,8203,2,1,1,0,0
kiodex eol co marketing agreement andy i have not received comments from jay yet i called him this morning but we have not connected yet drew kiodex eol co marketing agreement drew did you recieve jay webbs comments regarding what we discussed if not i can mark up doc and send back,13893,2,1,1,0,0
small world does carol have a sister named mimi who is married to a guy named steve houston there is a guy i work with here who is this guys houston best friend and the woman he is married to sounded like carols sister i know it sounds complicated hope you are faring okay with the recent events andy,18642,2,1,1,0,0
comparison model i am attaching the comparison model that i created i just wanted to give you this in case miller needs anything while i am gone give me a call if you have any questions my cell is,22136,2,1,0,1,0
winnie t what are you doing sending me this crap i want some dirty jokes i want some stories of wild drunken nights not this stuff we are getting into nyc on late on friday night i am picking up my number early on saturday morning would you be interested in going to dinner with a group of us to tony dinapolis on upper east side on saturday night were getting there at approx pm give me a call about this see ya ben,25159,2,1,0,1,0
happy birthday thanks man i feel like the old man that i am i only have years until it gets really bad hunting was great the dog did great he tried to attack a bull and went tearing through the brush i thought that i would never find him after he settled down he did great thanks for keeping the family tiffany told me that you guys taught her how to call the hogs brad,28788,2,1,1,0,0
tried to login to ubs enpower got this error embedded picture device independent bitmap,30312,2,1,0,1,0
comments to policy guys i am faxing to you my comments to the latest draft of the policy in case i am not in the office tomorrow please call me or bill with your comments when convenient so that we can respond to ace looks like we are really close carol st clair eb phone fax carol st clair enron com,31506,2,1,1,0,0
isda issues steve i am faxing to you my response to your guarnty comments while we are waiting on my credit person would it be possible to get a redraft of the schgedules from you since a good portion of the comments that we discussed i beleieve we agreed to and would help me focus on what is left to discuss with my people we have alos modified recently our form of lc and i have enclosed it for your review thanks carol st clair eb phone fax,35397,2,1,0,1,0
isda issues steve i am faxing to you my response to your guarnty comments while we are waiting on my credit person would it be possible to get a redraft of the schgedules from you since a good portion of the comments that we discussed i beleieve we agreed to and would help me focus on what is left to discuss with my people we have alos modified recently our form of lc and i have enclosed it for your review thanks carol st clair eb phone fax,36470,2,1,0,1,0
isda issues steve i am faxing to you my response to your guarnty comments while we are waiting on my credit person would it be possible to get a redraft of the schgedules from you since a good portion of the comments that we discussed i beleieve we agreed to and would help me focus on what is left to discuss with my people we have alos modified recently our form of lc and i have enclosed it for your review thanks carol st clair eb phone fax,37547,2,1,0,1,0
this definately sucks ass it is surreal i feel like i am watching a movie and this is happening to someone else other than work how are things i am so glad to be back in canada except that it is really really cold are you on the internal msn im take care chris does this suck my ass or what,38484,2,1,1,0,0
westcoast supply presentation when thursday january pm pm gmt mountain time us canada where enrons office,38981,2,1,0,1,0
updated westcoast supply presentation when thursday january pm pm gmt mountain time us canada where enrons office,39027,2,1,0,1,0
rrsp information tricia i am moving to our houston office and have some questions regarding my rrsp and pension with clarica can you give me a call when you have a minute on tuesday afternoon after pm when trading is done and i will come by and see you thanx chris,39681,2,1,0,1,0
yo who do i call to get my palm hooked up to my computer i have the palm cradle sitting on my desk,42410,2,1,0,1,0
my leg hurts still this is what im taking lodine xl tab mg take tab in the morning after my breakfeast snack cyclobenzaprine tab mg take tab before going to bed,45288,2,1,0,0,1
phone call kristian i tried to call this morning but i must be doing something wrong b c i am not getting through if you get a chance today or sometime this week give me a call chris,48493,2,1,0,1,0
bus passes please bill ainsley gaddiss bus pass to rc thanks chris stokley,48668,2,1,1,0,0
bus pass i think so sent the e mail thursday bus pass did you get ainsley sorted out nfb,48670,2,1,1,0,0
are you in the office today chad if you are in the office give me a call at or i wanted to see if you had time to get together and go do something tonight,48733,2,1,0,1,0
hello i am in houston give me a call at hello im in the houston office this week are you around if so email me your location so i can drop by and say hello monica,48736,2,1,0,1,0
feel free to edit comment thanks,49991,2,1,1,0,0
dream girl wanted to send you a reference to my dream girl http www ecologyproject org staff html scroll down to the julie osborn section i used to work with her in berkeley,51536,2,1,1,0,0
i tried to catch you before i left for this hlaa luncheon it started at to cya when i get back,55038,2,1,1,0,0
phone call sorry i did not get a chance to call you yesterday i will call you today on my conference time at please let me know where i can reach you,55914,2,1,0,1,0
hey i really really want to get out of here i was just told by my admin that when i get here at am that renee gets in a little after me and is watching me so i need to be careful of what i do what do they think i do play around this makes me so mad i could scream,55945,2,1,0,1,0
gymnastics pictures http pictures hunter gym page htm,62536,2,1,1,0,0
el paso transwestern burlington window rock conference call agenda attached is a proposed brief agenda for our conference call this afternoon at pm ct pm mt please feel free to provide me with any additions or comments to the agenda please let me know which phone number to initiate the conference call to thanks greg hills burlington resources marketing business development fax email ghills br inc com end of signature end of signature end of signature ep tw window rock mtg feb doc ep tw window rock mtg feb doc,73836,2,1,1,0,0
calme people guys hr should be in touch with you with regard to a couple of people that i have agreed to take from calme donahue maria elena garcia director duran boris feschiev manager mark provenzano manager regards delainey end of signature end of signature,83674,2,1,1,0,0
nicor enerchange comments to master hey girl i dont know what in the heck i was talking about nicor enerchange did send me the correct version please review and let me know what you have for them thanks patrice end of signature nicor enerchange comments to master hi patrice i am attaching our comments red lined to enrons master please call once youve had a chance to review thanks john serio end of signature revised master doc,86863,2,1,1,0,0
lunch sounds good to me is ok lunch i cant really take a long lunch today but i was thinking of grabbing something downstairs in the cafeteria would you be open we can catch up for a little while email me or call me on my cell phone stacey,88738,2,1,0,1,0
lunch i cant really take a long lunch today but i was thinking of grabbing something downstairs in the cafeteria would you be open we can catch up for a little while email me or call me on my cell phone stacey,88836,2,1,0,1,0
newco when you guys settle on a name for newco please let me know and also call lillian bailey at corp her is thanks df,98013,2,1,0,1,0
hey give me a number where sandra can reach merrilee she got a lead from a friend on a dis house df,98476,2,1,1,0,0
beer sent via the ev webmail system at mail ev net the man show boy beer stand wmv,100569,2,1,1,0,0
edf man gerri i just got your msg in the future pls call me at i have recently changed my phone number i am not sure if you have the extension for me we have talked to man but i do not know at this time the status of the money will let you know when i hear anything dutch,103724,2,1,1,0,0
dutch quigley enron com your ultimate woman request processed image instant access to the hottest girls in the world take your pick asian petite latina blondes brunettes redheads ebony average dutch quigley enron com subscribed and confirmed to this mailing to unsubscibe from this list please go here indias whore bikini babes hairy beavers cheerleaders horny housewives gang bang girls porn stars outdoors peeing teens dominatrix anal debutants cotton panties girls in uniform caught on camera amazing tits really fat chicks girls with girls pregnant covered in cum chix with dix cartoon sluts old hags long legs sexy smokers sinful sluts teen virgins triple penetrated wet pussy asian babes pink chocolate girls on film petite girls pin up girls,104080,2,1,1,0,0
dutch quigley enron com your ultimate woman request processed image instant access to the hottest girls in the world take your pick asian petite latina blondes brunettes redheads ebony average dutch quigley enron com subscribed and confirmed to this mailing to unsubscibe from this list please go here indias whore bikini babes hairy beavers cheerleaders horny housewives gang bang girls porn stars outdoors peeing teens dominatrix anal debutants cotton panties girls in uniform caught on camera amazing tits really fat chicks girls with girls pregnant covered in cum chix with dix cartoon sluts old hags long legs sexy smokers sinful sluts teen virgins triple penetrated wet pussy asian babes pink chocolate girls on film petite girls pin up girls,104123,2,1,1,0,0
tva letter final draft please call me w any final comments,109760,2,1,0,0,1
marc sekulas birthday celebration date have you heard anything about my friend marc sekulas birthday celebration date good for us,109974,2,1,0,0,1
bpa meeting when wednesday december pm pm gmt central time us canada where ecs call in number,110687,2,1,0,0,1
memory anytime after pm is fine i am at eb c fletch,121013,2,1,0,1,0
my onepass number bob my one pass number is yy thanks for the tip fletch,121216,2,1,0,1,0
shorts in buffalo hunterbob and fletch while i was walking today people were running and walking in their shorts my dads heat is not on happy belated thanksgiving mrha,121664,2,1,0,1,0
my last email from dell as of today i am moving on to my next career as a restaurant owner so if you are in austin come visit dona emilias at east th street under rulupasi inc management you will love it if you need to get hold of me send me an email at patcuero dotplanet com or at rulupasi excite com or call me at home the club and all that jazz will continue love patricia,126731,2,1,0,1,0
this is so awesome girls are evil jpg,128301,2,1,1,0,0
photos of coz nice job on the photos really makes me realize how drunk i was at certain times the good thing is that the dude i met in joes and i are now pen pals and he will be coming to houston to visit very soon maybe he was my long lost brother i am making a phone call to my mom right now too see if she has anything she wants to explain to me,129752,2,1,0,0,1
revised term sheets my comments are redlined into the doc,130697,2,1,0,1,0
crescendo meeting i will not be attending tomorrows crescendo meeting due to the monthly lost creek members meeting that i will be attending nick and rusty will be attending in my absence if you need to get in touch with me you can page me at or via my cell phone at thanks audrey,132246,2,1,0,1,0
picture gerald here is a picture from a cruise we took in january formalnight jpg i put some more pictures on www geocities com pbieraugel later paul formalnight jpg,133237,2,1,1,0,0
june th my flight schedule monterrey houston san diego june h co b arrives to houston at pm and leaves at pm on gate b return june th co t arrives to houston at pm and leaves pm on gate a can you gus come on sunday if so where shoul i meet you,136124,2,1,0,1,0
it needs can they meet me and colin my it manager at the office it is hard to go to lunch,141632,2,1,0,1,0
pm cst board call jim the board call will be at p m cst pls send me an email to verify receipt or call me at thx,144817,2,1,0,1,0
deadline today draft enron comments on nerc bill attached are suggested comments on the draft nerc bill for which we were asked to provide comments by today you will see that the response is a firm but polite no thanks while i doubt nerc assumes that silence means support by their deadline today i would like to get something to them by cob if at all possible i will be on vacation tomorrow in any event with apologies for the short turn around please call or e mail your comments or ok this afternoon john,147073,2,1,1,0,0
revised enron comments on nerc bill attached is revised draft of enron comments on the nerc bill the helpful editorial revisions came from charles and sarah,147075,2,1,1,0,0
epsa draft comments on information disclosure nopr memorandum to regulatory affairs committee power marketers working group from jim steffes regulatory affairs committee chair bob reilley power marketers working group chair julie simon vice president of policy date september epsa draft comments on information disclosure nopr comments due october th attached are draft comments on fercs notice of proposed rulemaking nopr for revised public utility filing requirements the comments are based on issues raised on our conference call on september th and from the outline sent out september th comments are due october th please forward any comments or proposed changes to the draft to jackie gallagher at jgallagher epsa org no later than noon on wednesday october rd so that we can make this filing in a timely manner if you have any questions or concerns please contact julie simon at attachment infodisclosurecomments doc,150236,2,1,1,0,0
weyman baby pictures never came thru please try again,151687,2,1,1,0,0
jtholt omni omninotes omninotes omnipab person frank ermis person julie a gomez person randall l gay person stanley c horton person tori kuykendall person michael w mcgowan person cindy k olson person julia white person omnipab omnitodos omnitodos omnicalendarentries omnicalendarentries omni,152610,2,1,1,0,0
life as a guy life as a guy asf,155982,2,1,1,0,0
