data,prob,index
pictures pictures of daddys little girl guess which one i like the best dsc jpg dsc jpg dsc jpg dsc jpg dsc jpg dsc jpg dsc jpg dsc jpg dsc jpg dsc jpg dsc jpg dsc jpg,0.9993217841324621,62529
gymnastics pictures http pictures hunter gym page htm,0.9682891947272078,62536
hugo compressor station i tried putting hugo on this morning and it didnt start bruce pals and mark rinke have been trying to get the unit on line and it is unavailable the guide vain actuator came apart and the controller and starters now have to be replaced,0.7232751971287911,77048
hey mom this is kara mom hey what are you up to nothing much here man today i had to mow the lawn man its really hot down here is it really hot there i still dont have a sun tan yet but its getting there u know man i miss u so much and i mean hah i dought you miss me u are probably haveing to much fun to even think about me thats ok im haveing alot of fun here too man i cant wait till i come home i miss u so much umm i really dontknow what else to say so i mean i guess iwill talk to you l er or sometin i have to go get ready to go to the mall and get somemore clothes and a new bathing suit and shorts and shoes so i will talk to you l er love ya byebye kara,0.9323154886776284,77283
picture day can do ds picture day was wondering if everyone could be available at a m thursday august for a group picture that will be used in an overhead at the kansas city winter ops meeting please let me know also let me know if i have left someone off this list thanks raetta,0.7137820103445903,77604
phone numbers im in chicago again i return this afternoon dg,0.7329984689118999,79155
hey i was sorry to hear about your mother i tried to call last night but you were not at home i told mom and she asked for your number i dont know if you have heard but enron was purchased by dynegy on friday the deal will not close until q but this will obviously affect me in some manner we will see take care dg,0.9664502233518638,81400
potential houston meeting dates carl either date works fine for me right now but i would prefer an afternoon or a late morning a m or after meeting i also would like jean adams to be available let me know what you think thanks janet potential houston meeting dates there are a growing number of things for us to discuss relative to gas supply for pleasant valley station i would like to suggest the following dates to meet in houston choice november a morning meeting choice novemer a morning meeting please let me know and reply all in your response if one or both dates work i will put together an agenda of the items for discussion,0.7199619263140211,81544
carol r harding aepin is out of the office i will be out of the office starting and will not return until i will respond to your message when i return,0.862084363725696,82198
calme people guys hr should be in touch with you with regard to a couple of people that i have agreed to take from calme donahue maria elena garcia director duran boris feschiev manager mark provenzano manager regards delainey endofsignature endofsignature,0.9511922996787571,83674
cpn aep guys it would be great to be able to go offsite in two different locations for these guys but given the fact i had to personally buy the paper for copying the termination packages i dont think there any funds to spend perhaps there are empty offices in allen please look into either way we need to ensure that these guys are fairly well seperated i am waiting for a confidentiality from calpine and aep this am regards delainey,0.8433705530001218,85877
nicor enerchange comments to master hey girl i dont know what in the heck i was talking about nicor enerchange did send me the correct version please review and let me know what you have for them thanks patrice endofsignature nicor enerchange comments to master hi patrice i am attaching our comments redlined to enrons master please call once youve had a chance to review thanks john serio endofsignature revised master doc,0.8568656040158639,86863
comments neededjanet dougherty rozycki your comments are needed for janet dougherty who sat in for joanne rozycki please return as soon as possible thank you becky ratings excellent above average average below average poor initiative cooperation punctuality attendance quality of work rate the workers skill level in relation to the job would you request this person again y n comments,0.8046896980094195,87037
please send me the name and phone number for your contact and i will work on a gisb with them dp,0.9131978687804713,89068
i have the old hair thing sat morning and after that i will be free see you sat,0.9559170248438065,89091
what a night go sooty sooty jpg,0.9971074997428371,90279
auto scheduler hey will remeber us dicussing deals showing up in realtime position manager that are the epmiwestbank can you remove these from this view thanks diana endofsignature auto scheduler for the west schedule analysis regards will endofsignature auto scheduler will can you tell me what day was the last to be rolled in auto scheduler im trying to go back into december to balance enpower for settlement purposes thank you diana scholtes,0.8735892211949382,91086
get out your light saber star wars is coming to houston click here for more details http home enron com messaging starwars jpg,0.9047109249940315,92315
unclassified rules these are the rules no exceptions especially any man who brings a camera to a bachelor party may be legally killed and eaten by his fellow partygoers under no circumstances may two men share an umbrella it is ok for a man to cry under the following circumstances a when a heroic dog dies to save its master b the moment angelina jolie starts unbuttoning her blouse c after wrecking your boss ferrari d one hour minutes seconds into the crying game e when your date is using her teeth unless he murdered someone in your family you must bail a friend out of jail within hours acceptable excuse for not helping a friend move a your legs have been severed in a freak threshing accident acceptable excuse for not helping a friend of a friend move a youd rather stay home and watch speed buggy reruns if youve known a guy for more than hours his sister is off limits forever unless you actually marry her the minimum amount of time you have to wait for a guy whos running late is minutes maximum waiting time minutes for a girl you have to wait minutes for every point of hotness she scores on the classic scale bitching about the brand of free beer in a buddys fridge is forbidden gripe at will if the temperature is unsuitable no man shall ever be required to buy a birthday present for another man in fact even remembering your buddys birthday is strictly optional on a road trip the strongest bladder determines pit stops not the weakest while your girlfriend must bond with your buddies girlfriends within minutes of meeting them you are not required to make nice with her gal pals significant dickheads low level sports bonding is all the law requires sorry ladies its called a double standard because its twice as true unless you have signed a lucrative endorsement contract do not appear in public wearing more than one swoosh when stumbling upon other guys watching a sporting event you may always ask the score of the game in progress but you may never ask whos playing you may flatulate in front of a woman only after you have brought her to climax if you trap her head under the covers for the purpose of flatulent entertainment shes officially your girlfriend only in situations of moral and or ass peril are you allowed to kick another guy in the nuts unless youre in prison never fight naked friends dont let friends wear speedos ever issue closed if a mans zipper is down thats his problemyou didnt see nothin women who claim they love to watch sports must be treated as spies until they demonstrate knowledge of the game and the ability to pick a buffalo wing clean chicken wing you must offer heartfelt and public condolences over the death of a girlfriends cat even if it was you who secretly set it on fire and threw it into a ceiling fan a man in the company of a hot suggestively dressed woman must remain sober enough to fight never hesitate to reach for the last beer or the last slice of pizza but not both thats just plain mean if you complement a guy on his sixpack youd better be talking about his choice of beer never join your girlfriend or wife in dissing a buddy of yours except if shes withholding sex pending your response phrases that may not be uttered to another man while lifting weights a yeah baby push it b cmon give me one more harder c another set and we can hit the showers d nice ass are you a sagittarius never talk to a man in a bathroom unless you are on equal footing both urinating both waiting in line etc for all other situations an almost imperceptible nod is all the conversation you need never allow a conversation with a woman to go on longer than you are able to have sex with her keep a stopwatch by the phone hang up if necessary when a buddy is trying to hook you up you may sabotage him only in a manner that gives you no chance of getting laid either you cannot rat out a coworker who shows up at work with a massive hangover you may however hide the aspirin smear his chair with limburger cheese turn the brightness dial all the way down so he thinks his monitor is broken and have him paged over the loudspeaker every seven minutes the morning after you and a babe who was formerly just a friend have carnal drunken monkey sex the fact that youre feeling weird and guilty is no reason not to nail her again before the discussion about what a big mistake it was always split aces and eights no arguments,0.9899793634138039,93074
hot or not news december hot or not news december www hotornot com be your own boss and work from home click here to get free information on how you can make up to per week merry christmas jim and james person of the week hot or not person of the weekclick here to rate her hi my name is linda i am years old and live in ontario canada i am a bookkeeper and a proud mother of a four year old son just wanted to say the hot or not site rocks hot gq men lean buff bodies brad pitt passion unique personalities intelligence classy people honesty sexy clothes sensual music dancing with a man that has rhythm not arrogance hot men with no personalities pick up lines tight jeans rude people selfishness copyright eight days inc all rights reserved this newsletter was sent to don baughman enron com to unsubscribe go to http www hotornot com news control oerqnl code nmnv and check please unsubscribe me on the form if the above link does not work please type http www hotornot com news control directly into your browsers address bar,0.8236442721057229,93762
thursday hey just wondering if youre at work get my message yesterday angie chat with friends online try msn messenger click here,0.9095109970701024,95121
houston hey got my facts together on our houston gigwell be down sat dec through mon the th any chance we could swing by on sunday and see you guys df,0.7953460559242674,97953
hey give me a number where sandra can reach merrileeshe got a lead from a friend on a dis house df,0.8640487823220732,98476
heywere still coming out next sat are you guys available for dinner on sat april i cant remember where we aare gonna be staying but we could meet you somewhere let me know df,0.9111973625718248,100388
just to remind you guys jit should be back in town tommorow night seeing if you guys wanted to do something with the man ricardo sent via the ev webmail system at mail ev net,0.997852374141744,100534
beer sent via the ev webmail system at mail ev net the man show boy beer stand wmv,0.9883625827156105,100569
edf mans excess thanks dutch i had not be informed until after you made the call so i begining to wonder about those guys gg edf mans excess gerri they david early told me that you have already been contacted that the money would come over they told me that it would dutch edf mans excess after the past week ive forgotten what normal was thanks for your help dutch when you find out if the money is being transfered would you please call me so that i can inform treasury thanks gg endofsignature endofsignature edf mans excess gerri we the financial natural gas desk were under the impression that dealings with edf man are suppose to be conducted as normal i am calling edf to find out why are money ahs not been wired as normal dutch edf mans excess hi dutch no all he said was that he hadnt been given instructions as of yet ive just called him again and he said that he was told that there would be no money transfered either way thanks gg endofsignature edf mans excess gerri did he say why he could not confirm the money transfer dutch edf mans excess good morning we have excess of with edf man i called and talked with paul this morning and he said that he could not confirm the wire for today as of yet ill let you know asap thanks gg,0.8588089685860508,100612
learn how to make sexy women or men go crazy over you amazing breakthrough for men women how to have beautiful men or women beg for you guaranteed to get you all the women or men you want without even trying click here now http www thisproductworks com go this message is never sent unsolicited monthlydrawing has been given the right to market to you through our web site partners and their privacy policies if you feel that your email was obtained by error or would like to optout of receiving future offers please click here or go to http www monthlydrawing com remove asp e dutch quigley enron com image,0.9825905161069289,101381
where do you hide a freak cock in an year old girl image where do you hide a freak cock in a year old girl any where you can fit it image young sluts take on pussy stretching ass splitting throat gagging giganticocks hard images movie clips live sex shows grab the lube squeeze on in today youve got a free pass image image thm tru gif thm tru gif thm tru gif lonna there is absolutely nothing not to like on this beautiful girl big breasts a clean shaven tight pussy and a wonderful smile when jessica wears tight jeans you can see her ass from miles away its thick and in shape and she wants men to see every curve on her body click for samples of lonna pick your pervertion x sft jpg x sft jpg x sft jpg this is not spam dutch quigley enron com subscribed confirmed to sexxxmailer unsubscribe here x sft gif a personal invitation for dutch quigley enron com what biggest baddest porn show when right fucking now whe here just click here whats inside you ask over live girls for you to fuck and chat with special live show from spain we are talking tennis racquets we are absolutely serious peeing tranny mature chopsticks bottles xlarge feet penetration yes indeed just pick a hole bicurious no problem completely uncensored celeb content b ss xclusive lesbo licking paparazzi video clip more you want more dont you worry just cum inside no credit card no check no emails no personal info no bulshit hentplay gif illegal celebrity photo hardcore asian huge tits fetish gay cartoon celeb cumshot mature orgy tranny black teen fatty adult amateur voyeur lesbian image if you have any problems with this process please email finalremove emailbucks com,0.9671309927480137,101393
i did not tell you but you were looking hot yesterday when you came down to the gym ily dq,0.978881486693628,103475
edf man sarah what i was remembering was the front months exposures we had at edf man prior to moves after dec jan feb mar apr the over all position before the move was and as of yesterday it is let me know what the concerns are at edf man and the request that they are making we can shift some positions around if the have levels by months that they want us to stay under dutch edf man dutch please send me the numbers sarah,0.9317375927586774,103681
new phone nnumbers i have changed my phone numbers to the following cell wk dutch,0.8669114545483682,103694
edf man gerri i just got your msg in the future pls call me at i have recently changed my phone number i am not sure if you have the extension for me we have talked to man but i do not know at this time the status of the money will let you know when i hear anything dutch,0.9659015391771493,103724
dutch quigley enron com miss teen body contest image image image image image image image image image image image image image image this is not spam dutch quigley enron com subscribed confirmed to sexxxmailer image image image image samantha this year old beauty had her boyfriend take some hot photos and send them into the miss teen body contest but she only took second place come see all her pictures and even chat with her live btw wait till you see the winner perfect teen bodiessexy young teen modelsinstant access image our sexiest teens are waiting for your cock you dont have to lure me into the bedroom thats where ill be waiting on the bed naked legs spread wide ive already grown impatient for your arrival i had to start without you i rubbed my own clit and rammed my fingers deep inside my cunt as i called out your name you followed the sound of my muffled moans and found me there waiting for you to take me as you walk towards me i look up with a smile and grab your cock through your jeans i can hardly wait to get you unzipped and in my mouth you fumble with your button as i yank off your jeans my tongue darts for your tool as i wrap my hands around your shaft and begin sucking with all my might the room fills with the sound of my lips slurping up every inch of your hard cock as i reach around and grab your ass cheeks my nails rip into your skin as my forefinger finds the rim of your ass you can feel your head tickle the back of my throat the pleasure is too intense you grab me by my hair and pull me off your cock as you shoot your load all over my face your hot cum drips slowly down my mouth i love it image image free pic my personal favorite think youll love this one free pic my friend mandy gets her tight teen pussy pounded free pic penetrate this little asshole in one deep thrust free pic beautiful blondes who cant hold it in anymore free pic check out this celebs naughty secret image over office workers have been fired for porn on work computers dont ruin your job or your marriage or your life by having someone finding porn on your computer click here to protect yourself,0.7808512257385536,103918
dutch quigley enron com your ultimate woman request processed image instant access to the hottest girls in the world take your pick asian petite latina blondes brunettes redheads ebony average dutch quigley enron com subscribed and confirmed to this mailing to unsubscibe from this list please go here indias whore bikini babes hairy beavers cheerleaders horny housewives gang bang girls porn stars outdoors peeing teens dominatrix anal debutants cotton panties girls in uniform caught on camera amazing tits really fat chicks girls with girls pregnant covered in cum chix with dix cartoon sluts old hags long legs sexy smokers sinful sluts teen virgins triple penetrated wet pussy asian babes pink chocolate girls on film petite girls pinup girls,0.9992111403135248,104080
dutch quigley enron com your ultimate woman request processed image instant access to the hottest girls in the world take your pick asian petite latina blondes brunettes redheads ebony average dutch quigley enron com subscribed and confirmed to this mailing to unsubscibe from this list please go here indias whore bikini babes hairy beavers cheerleaders horny housewives gang bang girls porn stars outdoors peeing teens dominatrix anal debutants cotton panties girls in uniform caught on camera amazing tits really fat chicks girls with girls pregnant covered in cum chix with dix cartoon sluts old hags long legs sexy smokers sinful sluts teen virgins triple penetrated wet pussy asian babes pink chocolate girls on film petite girls pinup girls,0.9992111403135248,104123
futures and options topics dutch quigley team here are my comments on futures very minor comments,0.7394404104171963,107123
meet on at home sorry again,0.9673432940732878,107762
meeting hi kriste can hit so we are going to try to meet at can you join us late,0.7616007357162725,108076
kid stuff thanks for the note i had alot of fun on sat too ill call you later to talk about camps i was kind of thinking of doing a day camp at the met but the teachers name for swimming at the h is lauren just call the regular number and ask for swimming and then leave message for her she will call you back,0.8309120604621262,108078
thanks for your call last night i am going to aa meetings almost every night these days i find them useful and helpful for sake of a better way to describe it unless i have some other activity plannd i usually go meetings that start at so i dont get home until clost to i really like the idea of going to the beach with you the triathlon weekend in late september would be great i dont know about doing the triathlon though i would love to but i am nowhere near in shape to do the running i tried to start running a few weeks ago after about a year off and i quickly developed a heel bruise running is out of the question for a while i have been swimming regularly since memorial day when the pool opened and i have been biking i watched parts of a public tv show about energy problems the last two nights enron came off as something like the evil rich king,0.813486674664462,108371
tuesdays brownie meeting hi moms if you have some time on tuesday afternoon we could use some additional hands at the brownie meeting one of our projects will be to make a situpon the girls will be lacing and beading and we think some extra hands to help will be necessary please reply if you can make it we probably will be starting the project around or pm sorry for the late notice and thanks in advance joy lee,0.9107037574086242,110417
upcoming brownie meeting hello first grade brownies and parents our november troop meeting will be november th at st lukes blanton building the meeting starts at and ends at pm parents who signed up to help at the meeting are melanie morgan and mk cooper just a few reminders remember to bring your assigned item for our troop first aid box if youve been called to turn in lingering paperwork please bring it to the meeting we try to end our meeting with a song or a closing ceremony please limit discussions in the area and siblings running around as the girls are very easily distracted we are going to be decorating tshirts at the meeting moms who are helping please wear old clothes also we will be showing the girls the different events they will be eligible to enter at striders striders is a girl scout track and field day this years event will be held on december st from noon to about pm paperwork will be coming home with the girls and will need to be returned very quickly please watch for it see everyone on the th mrs lee for all the leaders,0.8597773171090358,110483
meet hi how about trying to hit on wed afternoon or thurs lunch talk to you soon elizabeth sager,0.8121139417862082,111818
out of the office i will be out of the office the morning afternoon of i should be back around i can be reached on my cell phone bill,0.9814873129685681,112809
night shift for you guys had a busy night last night and did a good job of handling el paso and getting the reports done however we were not flat this morning in enpower long mws in np and short in sp and because we were not flat in california the enpower to caps report was incorrect variances listed as explained in the enpower to caps report were not your night note says however caps position manager flat for both days please make sure you have checked the position manager and updated your night note thanks bill,0.7958116522289973,113421
you go girl,0.9999999105457191,119813
phone numbers jeremy my pager number is my home phone is please call me when the migration is finished,0.7088279383273834,120004
prebid meeting todays prebid meeting will be held in from pm to pm patti please pass on to the schedulers,0.908819213431287,123368
revised pge ca stephanie attached is a redline with my comments,0.7010990002959847,124733
what up hey gt when are you coming to htown,0.9664914975336337,125141
filing form keith my changes are redlined please provide any comments,0.7170421391951937,125180
adios gdog my new phone number email address is as follows phone number this will be activated when we move in midjune my current phone is email rscook aep com give me a call or email me sometime frank,0.7972226759584718,125425
this is so awesome girls are evil jpg,0.8880732944754749,128301
username gnemec pass jbkg grn,0.9983928234365326,128375
boomer george jj john g i was thinking of bringing along a friend from enron to the boat party unfortunately he is not a female so this may throw off your proper party ratio he is married though so he will leave the single girls alone for you and me his wife is out of town this weekend he wont mind sleeping on the floor thanks for letting me hang at your place this weekend lisa is a really cool girl you two will have fun together,0.8422373102972652,129303
kristi called me last night tell her that i will buy her all the beer she wants if she goes to cozumel with us just two conditions craig stays home and she rooms with me,0.8192033811825681,129570
