data,prob,index
home depot this was sent to me from my friend who works at the home depot corporate office the stupidity of some people in this world never fails to amaze me this picture is real not doctored in anyway and was taken last week in waldorf md by a transportation supervisor for a company that delivers building materials for lumber when he saw it there in the parking lot of ihop he went and bought a camera to take pictures the car is still running as can be witnessed by the exhaust a woman is either asleep or otherwise out in the front seat passenger side the guy driving it was over jogging up and down on rt in the background the witnesses said their physical state was other than normal and the police just shook their heads in amazement the driver finally came back after the police were there and was getting down at the back to cut the twine around the load they told him to get back until it was taken off the materials were loaded at home depot their store manager said they had the customer sign a waiver both back tires are trashed the back shocks were driven up through the floorboard in the back seat are bags lbs each of concrete on the roof is many x s x s and osb sheets of lumber they estimated the load weight at lbs the car is a vw jetta with fl plates and the guy said he was headed for annapolis just unbelievable stupid jpg,0.8699901857224323,186326
stranger any interest in getting a drink or dinner tuesday havent seen you in forever,0.8524898786774866,186433
wanna get sauced after work,0.8686524189868656,186453
yea what are you doing after going to work out with dean at wanna go,0.8049168538679848,186836
eddie gaetchens marty and kevin from man are coming down wednesday if anybody is up for dinner or drinks,0.943682910023037,186950
does my boy marc findsen have a chance,0.867097014192058,187082
its a fake hey guys that picture is a fake how did the camera survive if you saw a plane coming straight at you would you take a picture or run for your life ha ha,0.9412148987631952,187600
meeting that would be fine just give me a call and let me know when you can meet jmf meeting i just returned from a training class can you meet a bit later this afternoon meeting kim can we meet around noon jmf meeting tuesday it is let me know when you might be available and i will try to work around your schedule regards kim meeting i will be attending a funeral tomorrow but i am available to meet on tuesday thank you for checking back with me jmf,0.7106904913023743,188105
contact list michael has asked me to put together a contact list please send me the following information as soon as possible name location office number fax number home address home phone home fax cell number pager number thank you megan,0.9387264854771675,189531
sorry not feeling too sexy right now what is going on send me an exciting sexy email to wake me up,0.8059800057023455,190712
come on you are always sexy sorry not feeling too sexy right now what is going on send me an exciting sexy email to wake me up,0.9394334339117929,190761
what good it is always good to be able to rely on someone my friend took off already she said she will be back to visit next month hee hee i think your friend puts you in a funky mood doesnt it i feel good as well when you smile at me there are alot of duplexes in the montrose area i know you will find something good morning i know this sounds corny but as soon as you said good morning and smiled at me i felt times better you always brighten my day i mean it i am doing ok this morning i went to see the apt and i didnot like it too small but i saw a few others that i want to take a look at today i did not get to speak to shelly last night i got home about pm i just went driving around montrose and i found some duplexes and fourplex apts then i had dinner late with my cousin and my friend mike and came home and went to bed i have just been in this funky mood dont know why good morning you look very nice today how are you doing how was the apt any problems at home because of shelly anyway have a great day i really love seeing you each day thanks for the ride yesterday i really appreciate it talk to you soon,0.7233243079632004,190966
hi we will try i hope that i can spend some time alone with you today even if it is only minutes why thank you you do as well you look so handsome today i was making a joke that your friend sees you every month what good it is always good to be able to rely on someone my friend took off already she said she will be back to visit next month hee hee i think your friend puts you in a funky mood doesnt it i feel good as well when you smile at me there are alot of duplexes in the montrose area i know you will find something good morning i know this sounds corny but as soon as you said good morning and smiled at me i felt times better you always brighten my day i mean it i am doing ok this morning i went to see the apt and i didnot like it too small but i saw a few others that i want to take a look at today i did not get to speak to shelly last night i got home about pm i just went driving around montrose and i found some duplexes and fourplex apts then i had dinner late with my cousin and my friend mike and came home and went to bed i have just been in this funky mood dont know why good morning you look very nice today how are you doing how was the apt any problems at home because of shelly anyway have a great day i really love seeing you each day thanks for the ride yesterday i really appreciate it talk to you soon,0.788250998591816,190986
i think your friend puts you in a funky mood doesnt it i feel good as well when you smile at me there are alot of duplexes in the montrose area i know you will find something good morning i know this sounds corny but as soon as you said good morning and smiled at me i felt times better you always brighten my day i mean it i am doing ok this morning i went to see the apt and i didnot like it too small but i saw a few others that i want to take a look at today i did not get to speak to shelly last night i got home about pm i just went driving around montrose and i found some duplexes and fourplex apts then i had dinner late with my cousin and my friend mike and came home and went to bed i have just been in this funky mood dont know why good morning you look very nice today how are you doing how was the apt any problems at home because of shelly anyway have a great day i really love seeing you each day thanks for the ride yesterday i really appreciate it talk to you soon,0.8174000193470865,190997
good it is always good to be able to rely on someone my friend took off already she said she will be back to visit next month hee hee i think your friend puts you in a funky mood doesnt it i feel good as well when you smile at me there are alot of duplexes in the montrose area i know you will find something good morning i know this sounds corny but as soon as you said good morning and smiled at me i felt times better you always brighten my day i mean it i am doing ok this morning i went to see the apt and i didnot like it too small but i saw a few others that i want to take a look at today i did not get to speak to shelly last night i got home about pm i just went driving around montrose and i found some duplexes and fourplex apts then i had dinner late with my cousin and my friend mike and came home and went to bed i have just been in this funky mood dont know why good morning you look very nice today how are you doing how was the apt any problems at home because of shelly anyway have a great day i really love seeing you each day thanks for the ride yesterday i really appreciate it talk to you soon,0.7233243079632004,191000
do you have blond hair oh i though i had missed something but yes glad i can rely on that sorry i am one of those people that you have to explain jokes to i was making a joke that your friend sees you every month what good it is always good to be able to rely on someone my friend took off already she said she will be back to visit next month hee hee i think your friend puts you in a funky mood doesnt it i feel good as well when you smile at me there are alot of duplexes in the montrose area i know you will find something good morning i know this sounds corny but as soon as you said good morning and smiled at me i felt times better you always brighten my day i mean it i am doing ok this morning i went to see the apt and i didnot like it too small but i saw a few others that i want to take a look at today i did not get to speak to shelly last night i got home about pm i just went driving around montrose and i found some duplexes and fourplex apts then i had dinner late with my cousin and my friend mike and came home and went to bed i have just been in this funky mood dont know why good morning you look very nice today how are you doing how was the apt any problems at home because of shelly anyway have a great day i really love seeing you each day thanks for the ride yesterday i really appreciate it talk to you soon,0.737031766048256,191012
we will try i hope that i can spend some time alone with you today even if it is only minutes why thank you you do as well you look so handsome today i was making a joke that your friend sees you every month what good it is always good to be able to rely on someone my friend took off already she said she will be back to visit next month hee hee i think your friend puts you in a funky mood doesnt it i feel good as well when you smile at me there are alot of duplexes in the montrose area i know you will find something good morning i know this sounds corny but as soon as you said good morning and smiled at me i felt times better you always brighten my day i mean it i am doing ok this morning i went to see the apt and i didnot like it too small but i saw a few others that i want to take a look at today i did not get to speak to shelly last night i got home about pm i just went driving around montrose and i found some duplexes and fourplex apts then i had dinner late with my cousin and my friend mike and came home and went to bed i have just been in this funky mood dont know why good morning you look very nice today how are you doing how was the apt any problems at home because of shelly anyway have a great day i really love seeing you each day thanks for the ride yesterday i really appreciate it talk to you soon,0.785978026071076,191014
hey sugar good morning how are you doing i love and miss you you are so wonderful hey baby call me when you get a chance i want to email this guy that bought the coat and i want to talk it over with you love you the pigs chorizo bellied,0.7205098056185563,191055
my evening was fine just watched a little tv then went to sleep before pm it was nice to get that much sleep i feel really good today i would have loved to been at foleys with you last nite sounds like a lot of fun hello how are you i had a good time last night it was fun they had some interesting drinks there and good food how was your evening good morning how are you this morning you look good as usual did you have a good time last nite i missed being with you this morning it is a nice way to start the day i hope that everything works out with us i dont want to put you in a bad situation i care about you too much have a great day and i will talk email you soon,0.9132522338069473,191123
will be in houston thursday friday would like to meet maybe have dinner if you guys can john and i talked about golf this coming weekend sounds good will call you guys monday thanks heff endofsignature,0.7319124860433703,192111
phone number marcus my office phone number is have a good weekend jeff,0.8491499143688138,192323
all of a sudden mark frevert asks me everyday about when well know about hedging re ppas and if we can delay the auction weeks the dream is still alive lets see my boys come through lavo,0.7586085698033362,193764
i keep hearing that mcsherry is gone yet his xxxxxx name keeps coming up lavo,0.806067163993003,193960
tease colts under tease colts over tease miami under tease miami over st louis minus,0.9257300363967537,194320
stuff for the am john louise asked me to give you the contracts she has for bernie lagrasta luce breslow will pass them in the morning neil,0.7312277986216509,196715
phone numbers lavo i will be in town all weekend i can reached anytime at one of the following numbers home cell scott,0.8548275857481695,197122
lavo this sounds fine lavo i had frank ermis talk to cowan about having an open line on our box to you guys i also asked frank to talk with cowan and calrk each morning to discuss the market we have a wed fundies meeting each week at i would like you guys to call in for this meeting let me know what you think grigsby,0.7790723355461399,199883
meeting can dorland and chad meet me and mili in video at and when these guys come back can cowan and lambie come to video,0.9555112621250867,200209
rules these are actually pretty good rules for men to live by any man who brings a camera to a stag night may be legally killed and eaten by his fellow partygoers under no circumstances may two men share an umbrella it is ok for a man to cry under the following circumstances a when a heroic dog dies to save its master b the moment angelina jolie starts unbuttoning her blouse c after wrecking your boss car d one hour minutes seconds into the crying game e when your date is using her teeth unless he murdered someone in your family you must bail a friend out of jail within hours acceptable excuse for not helping a friend move a your legs have been severed in a freak threshing accident b youd rather stay home and watch speed buggy reruns if youve known a guy for more than hours his sister is off limits forever unless you actually marry her the minimum amount of time you have to wait for a guy whos running late is minutes maximum waiting time minutes for a girl you have to wait minutes for every point of hotness she scores on the classic scale bitching about the brand of free beer in a mates fridge is forbidden gripe at will if the temperature is unsuitable no man shall ever be required to buy a birthday present for another man in fact even remembering your mates birthday is strictly optional on a road trip the strongest bladder determines pit stops not the weakest while your girlfriend must bond with your mates girlfriends within minutes of meeting them you are not required to make nice with her gal pals significant dickheads low level sports bonding is all the law requires sorry ladies its called a double standard and we drew the short straw on that one unless you have signed a lucrative endorsement contract do not appear in public wearing more than one nike swoosh when stumbling upon other guys watching a sporting event you may always ask the score of the game in progress but you may never ask whos playing you may flatulate in front of a woman only after you have brought her to climax if you trap her head under the covers for the purpose of flatulent entertainment shes officially your girlfriend it is permissible to quaff a fruity chick drink only when youre sunning on a tropical beach and its delivered by a topless supermodel and its free only in situations of moral and or ass peril are you allowed to kick another guy in the nuts unless youre in prison never fight naked friends dont let friends wear speedos ever issue closed if a mans zipper is down thats his problemyou didnt see nothin women who claim they love to watch sports must be treated as spies until they demonstrate knowledge of the game and the ability to drink as much beer as the other sports watchers you must offer heartfelt and public condolences over the death of a girlfriends cat even if it was you who secretly set it on fire and threw it into a ceiling fan a man in the company of a hot suggestively dressed woman must remain sober enough to fight never hesitate to reach for the last beer or the last slice of pizza but not both thats just plain mean if you complement a guy on his sixpack youd better be talking about his choice of beer never join your girlfriend or wife in dissing a mate of yours except if shes withholding sex pending your response phrases that may not be uttered to another man while lifting weights a yeah baby push it b cmon give me one more harder c another set and we can hit the showers d nice ass are you a sagitarius never talk to a man in a bathroom unless you are on equal footing both urinating both waiting in line etc for all other situations an almost imperceptible nod is all the conversation you need never allow a conversation with a woman to go on longer than you are able to have sex with her keep a stopwatch by the phone hang up if necessary when a mate is trying to hook you up you may sabotage him only in a manner that gives you no chance of getting laid either you cannot rat out a coworker who shows up at work with a massive hangover you may however hide the aspirin smear his chair with limburger cheese turn the brightness dial all the way down so he thinks his monitor is broken and have him paged over the loudspeaker every seven minutes the morning after you and a babe who was formerly just a friend have carnal drunken monkey sex the fact that your feeling weird and guilty is no reason not to nail her again before the discussion about what a big mistake it was get your free download of msn explorer at http explorer msn com intl asp,0.9958282967845659,201767
huntingdon pool gerry here is the rider we discussed the force majeure language goes with the delivery point so will be inserted in all confirms using that dp let me know if you or your customers have any comments greg johnston senior counsel enron canada corp phone greg johnston enron com endofsignature endofsignature,0.7647223482960674,202457
golf sat guys as discussed i am going to be tight on time tommorrow as such i am going to take my own car up and would suggest you two carpool together i am leaving houston at am and need to be back by thanks bt,0.8367906136435499,202518
reminder hey baby you are the only person who emails anything i have the dental forms can you take them to the dentist tomorrow if you get a chance thanks,0.7151089818397222,203246
brain transplant i know its sexist but oh so funny and true brain transplant in the hospital the relatives gathered in the waiting room where their family member lay gravely ill finally the doctor came in looking tired and somber im afraid im the bearer of bad news he said as he surveyed the worried faces the only hope left for your loved one at this time is a brain transplant its an experimental procedure semirisky and you will have to pay for the brain yourselves the family members sat silent as they absorbed the news after a great length of time someone asked well how much does a brain cost the doctor quickly responded for a male brain and for a female brain the moment turned awkward men in the room started to smile avoiding eye contact with the women and some actually smirked a man unable to control his curiosity blurted out the question everyone wanted to ask why is the male brain so much more the doctor smiled at the childish innocence and so to the entire group said its just standard pricing procedure we have to mark down the price of the female brains because theyve actually been used send this to a woman who needs a laugh and to the guys you think can handle it,0.7620892611852748,203961
the empty chair the empty chair a mans daughter had asked the local minister to come and pray with her father when the minister arrived he found the man lying in bed with his head propped up on two pillows an empty chair sat beside his bed the minister assumed that the old fellow had been informed of his visit i guess you were expecting me he said no who are you said the father the minister told him his name and then remarked i see the empty chair i figured you knew i was going to show up oh yeah the chair said the bedridden man would you mind closing the door puzzled the minister shut the door i have never told anyone this not even my daughter said the man but all of my life i have never known how to pray at church i used to hear the pastor talk about prayer but it went right over my head i abandoned any attempt at prayer the old man continued until one day about four years ago my best friend said to me johnny prayer is just a simple matter of having a conversation with jesus here is what i suggest sit down in a chair place an empty chair in front of you and in faith see jesus on the chair its not spooky because he promised ill be with you always then just speak to him in the same way youre doing with me right now so i tried it and ive liked it so much that i do it a couple of hours every day im careful though if my daughter saw me talking to an empty chair shed either have a nervous breakdown or send me off to the funny farm the minister was deeply moved by the story and encouraged the old man to continue on the journey then he prayed with him anointed him with oil and returned to the church two nights later the daughter called to tell the minister that her daddy had died that afternoon did he die in peace he asked yes when i left the house about two oclock he called me over to his bedside told me he loved me and kissed me on the cheek when i got back from the store an hour later i found him dead but there was something strange about his death apparently just before daddy died he leaned over and rested his head on the chair beside the bed what do you make of that the minister wiped a tear from his eye and said i wish we could all go like that just send this to four people and do not break this please prayer is one of the best free gifts we receive there is no cost but a lot of rewards i never said it would be easy i only said it would be worth it god netzero free internet access and email http www netzero net download index html,0.846100862003587,204101
please call me back urgent trp jennifer love hewitt anna kournikova did you hear the news about jennifer love hewitt and anna kornikova whew i guess that paris just brings out the worst in these hot little celebrities we have shocking fotos that you must see to believe a net first http cgibin web pages anna jennifer index html young girls fucking at school wanna see what teenage girls do after school wanna watch them touch their hot little pussies after class if so click the link below http cgibin web pages schoolgirls index html wanna see britney spears pussy wanna see britney spears teenage pussy getting fingered by an older fan wanna see lots of other celebrities with cum on their faces http cgibin web pages celeb index html teen sluts covered in sperm these dirty little sluts cant wait to get their hot twats full of sperm thats right they dont just like to get fucked they love to have their pussies cummed in so be sure to shoot your load in becky she really likes it http cgibin web pages teen index html girl next door wants to be a porn star watch as amy goes from the sweet innocent virgin girl next door to the raging cum craving slut that she has been for the past days you are getting her first amazing a must see http cgibin web pages virgin index html amazing live fuck parties ever wonder what happens after hours when the girls from the strip clubs get really really drunk we thought so so we show you live these drunken vixens get pounded in every single last hole http cgibin web pages orgy index html removal instructions to remove yourself from all further mailings please follow the link below and you will be removed from all further mailings all removes are honored http removes remove html,0.8219257391523996,206704
gorgeous amateur teen girls kexkkfte want to see awesome amateur teen sluts get nude just for you these girls are hot cum check it out now http members amateurteens our amateur teens are super hot and love to have sex watch our fresh young babes get fucked hard while trying out for their first porn movie the action is mindblowing http members amateurteens to be removed from our future mailings please click below http members amateurteens remove html,0.9904598756682538,206794
annuity approval and autoschedule kate please auto schedule the following annuities les,0.7630770173745721,211097
