data,prob,index
hello rudedog how is it going out there brother been keeping your sanity while living at home things here are about the same talked to your boy tree the other day he had some interesting new developments in his love life of course they were sordid and made me somewhat uncomfortable well sort of your furniture is still almost completely intact the longer you stay out there the better my chances of picking up some furniture real cheap havent seen that much of janel lately she went out to florida this weekend to convince a gay guy that the opposite sex is not icky after all should make for some interesting stories when she returns drop me a note when you get a chance talk at you later g,0.7607590850927461,130113
football gt i think i will probably come in tonight since the game is so early are you guys going to try and buy tickets at the gate for bb email back with your phone numbers so i can call if anything changes talk at ya later g,0.8531015271247272,130582
pictures the pictures were very amusing thanks for sending those along looks like you guys hung out quite a bit with the neighbors i especially like the candid shot of me in my tommy hilfigers whoa got to start working out and shed the love handles i thought there would be more shots of squid roe since that is where you guys hung out most of the time looks like your mariners made the playoffs i really dont follow texas but i do follow the astros i think everybody is just happy the season is over with so we can forget it as quickly as possible the astros were pretty horrible this year hope you are doing well did you keep julie and angie out of trouble this weekend i know that is probably impossible thanks for the pics again and ill talk to you later gerald,0.9086430598787723,130592
i am a sex machine,0.8372907164752029,132387
picture gerald here is a picture from a cruise we took in january formalnight jpg i put some more pictures on www geocities com pbieraugel later paul formalnight jpg,0.909947875562783,133237
weve been shopping get this guy a truck and a brain,0.8916515813937725,133303
gty comments fpl here are the customers comments to the standard outgoing bridgeline holdings gty for bgml please review and let me know thanks brant endofsignature endofsignature endofsignature,0.8905208967577142,133733
hey also i feel bad i would have invited you to the movies but i thought you were planning your workout,0.7053097986159259,133835
comments neededshelly smith your comments are needed for shelly smith who sat in for pat radford please return as soon as possible thank you becky excellent above average average below average poor initiative cooperation punctuality attendance quality of work would you request this person again y n comments,0.870060551663488,134253
fwd no subject just in case you were thinking about doing this ten reasons to go to work naked no one ever steals your chair gives bad hair day a whole new meaning diverts attention from the fact that you also came to work drunk people stop stealing your pens after theyve seen where you keep them you want to see if its like the dream to stop those creepy programmer guys from looking down your blouse id love to chip in but i left my wallet in my pants inventive way to finally meet that special person in human resources can take advantage of your computer monitor radiation to work on your tan and drum roll the number one reason to go to work naked your boss will never say i wanna see your ass in here by ever again,0.9842423232991814,134686
adios gdog my new phone number email address is as follows phone number this will be activated when we move in midjune my current phone is email rscook aep com give me a call or email me sometime frank,0.7972226759584718,134726
did you get the picture,0.9998814208158774,136067
whats your cell i think i gave mike cyrus your home i talked with him last night and he was going to give you a call lets you and me try and talk today i have some material about these guys that you will appreciate ben,0.8365430602973762,138169
please come share cake and wish susie wilson well today is susies last day before maternity leave please come have a piece of cake and wish her well cara embedded picture metafile,0.7328051795448377,139100
out of office notice i will be out of the office,0.9384468457806262,139140
wtc voicemail good morning wtc voicemail is down the link between wtc and qwest is not working pge has reported the problem at am and we are waiting to hear whats happening quick reminder on what can occur when voicemail goes down and what your might experience when the link comes back up the message waiting light wont go off after you retrieve your messages if this occurs just have the person lift the handset hear dial tone and dial this will clear the message waiting light the message waiting light is not on and you could have a message have employees check their mailbox just in case they are expecting critical messages the next voicemail will activate the message waiting light please let me know if you have questions or concerns,0.7417737139412104,139201
your message bob in my reply to joe hillings last night i told him you would be following up with him this is his reply to that message jim your message thank you jim joe,0.8551237803781964,143595
deadline today draft enron comments on nerc bill attached are suggested comments on the draft nerc bill for which we were asked to provide comments by today you will see that the response is a firm but polite no thanks while i doubt nerc assumes that silence means support by their deadline today i would like to get something to them by cob if at all possible i will be on vacation tomorrow in any event with apologies for the short turn around please call or email your comments or ok this afternoon john,0.8074979074008172,147073
revised enron comments on nerc bill attached is revised draft of enron comments on the nerc bill the helpful editorial revisions came from charles and sarah,0.834859843301733,147075
affiliate code of conduct nopr comments extension of time ferc has issued a notice of extension of time to file comments on the notice of proposed rulemaking nopr on standards of conduct for transmission providers the due date for comments is now december the notice is attached rm b doc,0.9103904279239822,147404
rto comments attached are draft rto comments the comments reflect epmis views on rto development given the commissions apparent recent changes in position on the number of rtos to be created we urge right sized rtos without choosing a number the comments reflect input from christi dave perrino steve walton mike roan andy and charles please review the sections where you have had input to make sure we adequately reflected your points but please also review the entire document and let us know your thoughts im still filling in cites and bernadette will be working on the formatting but the document is hopefully in pretty good shape there is no filing deadline for these comments but we would like to submit them on monday if possible it shouldnt take more than an hour to review in sending your comments please reply to all so everyone receives your comments thanks for everyones help susan we should also have kevin review the comments alan tim should probably review the comments as well but check with dave and steve to see if the lmp in the west argument is correct before you show him the comments sarah,0.8992797421822285,147408
comments of the other parties on el paso system reallocation rp this is a summary of the comments weve received so far from the other parties who filed on october ill summarize the others as they come in and redistribute this report,0.7353396177052182,147689
comments due on ferc june order i thought we were responding through some other group jim comments due on ferc june order this meeting is tomorrow but when you head up to portland could you see if there is any interest in responding to this ferc request through wptf or otherwise we have to pay of course comments due on ferc june order the fercs june th market mitigation order provided that parties could file followup comments within days with regard to how the market has functioned under the order and what changes should be made to the mitigation approaches the specific language provides as follows mitigation beyond summer although we are confident of the efficacy of our westwide mitigation plan throughout the summer of we nonetheless wish to obtain comment for the purpose of revising the mitigation methodology for future periods if necessary accordingly we invite interested partes to file with the commission comments and proposals concerning any developments either beneficial or adverse which have occurred in the western region spot markets as a result of this order any difficulties with implementation of the mitigation plan detailed in the order and the relevant solutions thereto and most importantly any alternative market mitigation approaches in order to provide for timely review and analysis we will require that parties comments and proposals be submitted to the commission within days of the date of issuance of this order at tomorrows wptf board meeting we will be discussing the filing of comments which would be due next monday in response to this invitation this email is a headsup that it would be helpful for board members to begin sending comments and suggestions with regard to the three topics noted above thanks dan law offices of daniel w douglass topanga canyon blvd suite woodland hills ca tel fax douglass energyattorney com mailto douglass energyattorney com endofsignature endofsignature,0.7222804043509767,148753
williams comments on ercot standard ia attached are comments williams developed on the ercot standard generation interconnection agreement we hope these comments will be helpful in flagging issues of concern to the caucus additionally the comments recommend specific language changes to the ercot ia we hope these suggestions will be useful in transforming the ercot ia into a national standardized agreement the comments reference language in the hazelton interconnection agreement er this agreement can be found on rims using the following link http rimsweb ferc gov rims q rp getimagepages williams memo doc,0.8138576568409671,149924
epsa draft comments on information disclosure nopr memorandum to regulatory affairs committee power marketers working group from jim steffes regulatory affairs committee chair bob reilley power marketers working group chair julie simon vice president of policy date september epsa draft comments on information disclosure nopr comments due october th attached are draft comments on fercs notice of proposed rulemaking nopr for revised public utility filing requirements the comments are based on issues raised on our conference call on september th and from the outline sent out september th comments are due october th please forward any comments or proposed changes to the draft to jackie gallagher at jgallagher epsa org no later than noon on wednesday october rd so that we can make this filing in a timely manner if you have any questions or concerns please contact julie simon at attachment infodisclosurecomments doc,0.9333163799168419,150236
weyman baby pictures never came thruplease try again,0.9999911164388963,151687
jtholt omni omninotes omninotes omnipab person frank ermis person julie a gomez person randall l gay person stanley c horton person tori kuykendall person michael w mcgowan person cindy k olson person julia white person omnipab omnitodos omnitodos omnicalendarentries omnicalendarentries omni,0.9729265842409635,152610
did you watch your girl on tv last night,0.9994918278851908,154341
life as a guy life as a guy asf,0.9990586164280196,155982
how are things how has your morning been,0.9708202609095844,156870
i had so much fun last night when can we do it again,0.9757024635365382,159090
schools out keep in touch click now to visit classmates com today home,0.9846869213152113,161011
need your phone number dude i need your phone number pronto,0.7250463129510683,162568
comments on pg e qf auction presentation overall looks great though i made a few edits comments but i couldnt figure out how to do it in strikeout underline we should make it look as pg ecentric as possibleyou know how touchy ious are you and dave and i should try to discuss in more detail early next week best jeff endofsignature endofsignature,0.7831134817550797,162682
meeting with perfect hi brad i finally got in touch with the people from perfect theyll be in houston on the th and the nd of november either of those days work for you if so any time preference best jeff,0.7870488752081055,163281
meeting with enron its going to be sometime in the afternoon on the th,0.7779443300489404,163379
jim perkins the best man at our wedding is coming to stay with us august th i know how much he would enjoy meeting seeing all of you can you all come up one of those days or it is even ok if you come separately nancy phone fax plus je bois mieux je chante,0.7522951315141567,163563
comments to office of management budget on ferc reporting requirements for we faxed the attached comments today to omb in response to their notice issued yesterday because i did not see the notice about the deadline being yesterday until after yesterday we did not have time to send this out for a complete review but leslie did talk to steve kean about it and we incorporated his comments our comments dispute the accuracy of fercs estimate of the time required per respondent to comply with the requirements hours for the initial report and hours for subsequent reports as we explain because we dont manage our business in the way the reporting requirements contemplate compliance will require manual review and analysis and fercs time estimates are vastly underestimated from our standpoint ferc has asked omb to make a determination by august th so we felt it was important to get this to omb as quickly as possible,0.7614438447450412,163708
did you burn the man are we having lunch are you famous now,0.8742137828446419,164343
did you burn the man are we having lunch are you famous now,0.8742137828446419,164344
info on np has sue gotten in touch with you and have you contacted tim belden in portland he is the absolute guru on this stuff,0.9370425720507092,164761
daimlerbenz i didnt get an email on german gaap from the professor,0.8137776098289228,165569
comments to govs proposals here they are please review and provide comments quickly id like to get this off to kari asap thanks jeff,0.8433307826647205,165940
abx man youre quick thanks very much this is really starting to get wierd makes cuba look capitalist best jeff,0.7113585909805409,166692
follow up with alperts office call hedy at best jeff,0.9381086210400612,167327
group projecte you get the message class was cancelled last nite before heading over to berkeley,0.8196544568909727,167350
fyi when are comments due,0.9999999949281868,167376
got message hearing start yet jeff,0.8725930324123121,167827
can you be home am,0.9847840741351863,168217
enron contacts bibis the manhes the guy i mentioned when we discussed the other night,0.9994133958950904,168313
cesg meeting notice greetings will there be a callin number best jeff,0.7595127113243322,168399
night out at the blue chalk message body,0.9258235509073055,169761
your famous hey jeff what a surprise yesterday i was looking at the latest berkeleyan and on page three there you were have you seen the picture it is from the electricity summit it is a picture of you and a guy that looks like burl ives it sort of looks like he is telling you an off color joke it also says that you are director of enron corp anyway it was great treat to see you in the local rag brightened my day tc,0.9582361191445646,170428
joe hartsoe corp enron is out of the office i will be out of the office starting and will not return until if the matter is urgent please contact sarah novosel at otherwise i will respond to your message when i return,0.758011095788464,171031
a pg e reply comments all attached are pg es reply comments in the pg e california gas transmission open season docket a after readying the hardcopy comments for service by u s mail a couple of typos came to our attention we have corrected the typos in this email this email contains two files a redline version showing typo corrections changes from the hardcopy version sent out by u s mail a file showing the redlines accepted david w anderson pg e law department email redline pge reply comments rtf email pge reply comments rtf email redline pge reply comments rtf email pge reply comments rtf,0.9074655796826538,171833
new draft of enron statement sues comments attorneyclient priviledge attorneyclient priviledge prepared for ferc settlement discussions here are my comments it looks pretty good i was hampered by not knowing the objective of the piece i made changes to fix inaccuracies or inferences i also have notes comments rationales shown in boldface sue mara enron corp tel fax,0.7071703565830855,172207
documents for your review see attached file sce comments redline merged leg language doc sce comments redline merged leg language doc,0.9409532827006236,172253
great job you guys did a terrific job on the frontline program last night,0.9408232086039034,174565
night of men men wanting to man off needing to man off are we still planning on being with men on thursday only men need to respond piggy,0.9996344478785882,176614
man night final plans men the final descision on the night of men will be as follows where tonys mexican bring your own clown and accessories please when thursday at pm we will wait until zander is able to attend to try the tampico place would rather go w someone who knows the drill i am very much looking forward to seeing all of you men pignastinkyblanket,0.99986674816116,176618
man night men hunting season is over it is now working season all email threads are gone no one talks to one another this is wrong i therefor propose man night february th at some location yet to be determined such as tonys mexican food on ella e chat with friends online try msn messenger http messenger msn com,0.9912171552882342,176984
last night sounds like you were the one blowing it off last night uuhh what happened to yall last night thanks for blowing it off w o letting me know ritas were good and plenty had a few and decided to stick it out alone actually met a whole new pile of friends there hallelujah,0.8766717845271972,177098
ene did you boys see the news,0.9981057961133394,177185
man night final plans yes according to chets coworker man night final plans is thursday night man night for those kinds of men too man night final plans so your proposing we are going to the stabbing cabin go to tampico man night final plans men the final descision on the night of men will be as follows where tonys mexican bring your own clown and accessories please when thursday at pm we will wait until zander is able to attend to try the tampico place would rather go w someone who knows the drill i am very much looking forward to seeing all of you men pignastinkyblanket boilerplate disclaimer boilerplate disclaimer this email is the property of enron corp and or its relevant affiliate and may contain confidential and privileged material for the sole use of the intended recipient s any review use distribution or disclosure by others is strictly prohibited if you are not the intended recipient or authorized to receive for the recipient please contact the sender or reply to enron corp at enron messaging administration enron com and delete all copies of the message this email and any attachments hereto are not intended to be an offer or an acceptance and do not create or evidence a binding and enforceable contract between enron corp or any of its affiliates and the intended recipient or any other party and may not be relied on by anyone as the basis of a contract by estoppel or otherwise thank you boilerplate disclaimer,0.970503806536547,177434
man night then by no means should anyone answer the dinner question before a week from this next monday man night thats a sure betactually it wont be until monday as e is in new mexico at taos skiing grumbling why they wont allow snowboarding there i hope he doesnt get any blood on my ski stuff he borrowed lets overload his e mail whilst he is away hey erk erk hey hey erk why why why why erk hey erk why bet man night anyone want to place bets on how long it is before erik comes back w an email similar to men all the banter is appreshe ted and good however once again there has been only talk of noncents and noone has respanded to the proposol regarding dinner i therefoar suggest rsvp by toomarrrough man night maybe joe is just the patsy not the real trigger man man night regarding the valentines story so it was the marines that got blood on the clown suit man night men hunting season is over it is now working season all email threads are gone no one talks to one another this is wrong i therefor propose man night february th at some location yet to be determined such as tonys mexican food on ella e chat with friends online try msn messenger http messenger msn com,0.9961335852520034,178442
man night final plans is thursday night man night for those kinds of men too man night final plans so your proposing we are going to the stabbing cabin go to tampico man night final plans men the final descision on the night of men will be as follows where tonys mexican bring your own clown and accessories please when thursday at pm we will wait until zander is able to attend to try the tampico place would rather go w someone who knows the drill i am very much looking forward to seeing all of you men pignastinkyblanket boilerplate disclaimer boilerplate disclaimer this email is the property of enron corp and or its relevant affiliate and may contain confidential and privileged material for the sole use of the intended recipient s any review use distribution or disclosure by others is strictly prohibited if you are not the intended recipient or authorized to receive for the recipient please contact the sender or reply to enron corp at enron messaging administration enron com and delete all copies of the message this email and any attachments hereto are not intended to be an offer or an acceptance and do not create or evidence a binding and enforceable contract between enron corp or any of its affiliates and the intended recipient or any other party and may not be relied on by anyone as the basis of a contract by estoppel or otherwise thank you boilerplate disclaimer,0.962492518543835,178542
man night report i thought this was off thanks for letting me know the location or is this a joke im confused man night report attendees me pig zander and small zander ate a lot of crustaceous bugs drank a lot spent money on raffle tickets because the chick selling them was hot won nothing drank more woke up on couch i feel horrible overall a success despite attendance ready to go again c,0.9841338182093864,179037
where are you woman call me,0.9453872420066645,179534
absolutely beautiful open in private nicolevancroft jpg nicolevancroft jpg nicolevancroft jpg nicolevancroft jpg nicolevancroft jpg nicolevancroft jpg,0.7117811492760281,179927
picture of house good morning carla and rhi this is like our own little spy game thanks for taking the picture i hope you had a nice thanksgiving i will talk to you soon joseph picture of house hey this is the picture we took sorry you cant see too much house doc file house doc,0.9462986067976621,180102
picture of house hey this is the picture we took sorry you cant see too much house doc,0.9993359068060784,180286
stepenovitch i left a message and she did not return my call,0.7328959919437005,181051
denver ariz minn phili under tease all,0.7084726076954945,182772
i wanted to see how they would handle themselves glad i did i guess schweig did all the yelling for everyone do you want to go to learn what happened or do you want to go yell at those guys see those guys get yelled at,0.9473310065821524,182885
ge persons visiting friday the th derryl thanks for pulling me in to meet john schroeder account manager whom i had met earlier with graham gebbie and marco arcelli sales manager pipelines look forward to keeping in touch on this if any buy side opportunities are evenutally pursued thanks again sarahjoy,0.7366252689549988,184622
dinner tonite birthday boy,0.9342993934694136,184873
are you free for a drink dinner wednesday night,0.7179237801952896,185339
stranger any interest in getting a drink or dinner tuesday havent seen you in forever,0.8524898786774866,185681
