data,prob,index
why should men have all the fun why should men have all the fun let me introduce you to vigel a topical gel that increases feminine sexual pleasure and excitement click here to find out more about vigel remove yourself from this list by either entering your email address below and clicking remove or reply to this message with the word remove in the subject line this message was sent to address andrew h lewis enron com pmguid k mwy edkxk pmg,0.969479514862365,12718
kiodex eol comarketing agreement andy i have not received comments from jay yet i called him this morning but we have not connected yet drew kiodex eol comarketing agreement drew did you recieve jay webbs comments regarding what we discussed if not i can mark up doc and send back,0.7371763315899669,13893
baseball and the irishman arkansas joke guy is driving down a rural road in arkansas cop pulls him over and asks got any id guy replies bout what nother one the toothbrush must have been invented in arkansas otherwise it would have been called the teethbrush,0.9005806009828298,18391
small world does carol have a sister named mimi who is married to a guy named steve houston there is a guy i work with here who is this guys houston best friend and the woman he is married to sounded like carols sister i know it sounds complicated hope you are faring okay with the recent events andy,0.9819682737112707,18642
i think its spelled gaetien and i would like to see those guys so count me in if it happens,0.7760513632663657,18649
new info duane i have moved my new info for now is as follows hm wk email kingdh msn com keep in touch duane,0.7295198116182096,18705
golf sat guys as discussed i am going to be tight on time tommorrow as such i am going to take my own car up and would suggest you two carpool together i am leaving houston at am and need to be back by thanks bt,0.8367906136435499,19981
fundys meeting today pls make sure that you guys are attending the fundys meeting mara and yourself thanks bt,0.7979567345621621,20006
eweb guys heres what we sent eweb,0.9771188197455342,20160
celebrity quotes and theres no truth to the rumor that these quotes came from marc stewart women might be able to fake orgasms but men can fake whole relationships sharon stone honesty is the key to a relationship if you can fake that youre in courtney cox monica on friends i read somewhere that per cent of all the mentally ill live in poverty actually im more intrigued by the per cent who are apparently doing quite well for themselves jerry garcia grateful dead clinton lied a man might forget where he parks or where he lives but he never forgets oral sex no matter how bad it is barbara bush former us first lady ah yes divorce from the latin word meaning to rip out a mans genitals through his wallet robin williams women need a reason to have sex men just need a place billy crystal instead of getting married again im going to find a woman i dont like and just give her a house rod stewart on the one hand well never experience childbirth on the other hand we can open all our own jars bruce willis on the difference between men and women and god said let there be satan so people dont blame everything on me and let there be lawyers so people dont blame everything on satan george burns my girlfriend always laughs during sex no matter what shes reading steve jobs founder apple computers hockey is a sport for white men basketball is a sport for black men golf is a sport for white men dressed like black pimps tiger woods capital punishment turns the state into a murderer but imprisonment turns the state into a gay dungeonmaster rev jesse jackson my mother never saw the irony in calling me a sonofabitch jack nicholson women complain about premenstrual syndrome but i think of it as the only time of the month that i can be myself roseanne according to a new survey women say they feel more comfortable undressing in front of men than they do undressing in front of other women they say that women are too judgmental whereas of course men are just grateful robert de niro in the last couple of weeks i have seen the ads for the wonder bra is that really a problem in this country men not paying enough attention to womens breasts hugh grant theres a new medical crisis doctors are reporting that many men are having allergic reactions to latex condoms they say they cause severe swelling so whats the problem dustin hoffman when the sun comes up i have morals again elizabeth taylor theres very little advice in mens magazines because men think i know what im doing just show me somebody naked jerry seinfield and the number one quote is see the problem is that god gives men a brain and a penis and only enough blood to run one at a time robin williams,0.7777493161795337,20775
beer stand if you dont have a broadband connection this will probably take too long for everyone else its worth the wait and its clean see attached file the man show boy beer stand wmv,0.7713954482235122,20848
another man show boy ill send the beer boy but i dont have your home email,0.9998178978063035,20983
hey whats going on i am heading to dc this weekend with verrechio introducing him to a friend of the girl i am dating should i kiss my relationship goodbye now or wait for verrechio to do that for me gioffre get your private free email at http www hotmail com,0.9738655874198385,21461
never complain about what you dont have i think there was an ac dc song about this guy testicles mpg,0.7553743715306502,21721
genco meeting the meeting has been switched to pm over near room tba let me know if this doesnt work for any of you thanks ben,0.7959767117280135,23417
school visit professor ronn thank you for your reply i have a meeting at am but i am free from am to am if you could let me know what the best time for me to stop by your office i would appreciate it i look forward to meeting you tomorrow ben rogers,0.7668010413385259,23547
please come by and help us clean up the look out gravy train coming through,0.7967343104139967,24540
in you pants,0.8066551947073942,24695
hey ashley please give me a call at which is my work phone at enron i look forward to talking to you about enron regards ben,0.7992228070322448,24967
i wonder why now you guys can be in the drivens seat with regards to them ben,0.981885066141024,25335
im so glad you are still alive sara check this story out this is from a guy on our floor hes a summer intern and this is his tuesday morning story incidentally i was standing directly in front of the old women picking out some green onions for my omelet when all hell broke loose i took about three steps back and wandered towards the kitchen in search of a fire extinguisher didnt find one and like scott the intern was a bit disappointed in my reactions ah well i dont usually send out a group email but listen to this shit so i am sitting at work this morning minding my own business when all hell breaks loose it is about am and most of the trading has subsided for the morning i decide to grab the first ham and cheese omelet from the women that are serving our breakfast this morning because who knows how long the food will last today is a special day because we get a fresh cooked breakfast from a propane grill as opposed to the green eggs and ham that we are used to because no one wants to get up at am and cook a fresh breakfast for enron employees they usually cook it the night before so everyone on the floor is very excited and pumped up about the possibility of grabbing a nice breakfast without having the fear that later in the afternoon your ass would wreak havoc on you for eating the nasty green eggs so i grab the first omelet and the crowd surges toward the two yearold women at the grill everyone is smiling deciding whether or not they want ham or maybe they will get crazy and add salsa or something the next thing you know straight out of a fox tv show or youve gotta see this episode this old woman is engulfed in flames like the great fire of chicago the propane tanks heating the stove exploded and the flames are high and wide raising up to ten feet in height the place turns into a frenzy nobody can move react or anything everyone is frozen watching this old woman picture happy gilmores grandma go up like an old christmas tree a few seconds before this high school chemistry experiment i was sitting on the first row right in the middle and i was staring at my two liquid display computer terminals and glancing at the sports ticker on espn on the inch liquid flatscreen tv that is directly above my desk the old woman that went into flames is directly in front of me about a literal three feet away and i am directly facing the inferno along with a coworker who is catching the blunt of the heat of the flames i dont save the old woman like most of you might have thought i cant do anything but shout obscenities and wonder who the hell is going to jump in there and save this poor lady the old woman is yelling somebody get me outta here yet we all continue to stare finally someone grabs her arm and yanks her out of the blaze who is this masked man i have no clue however i do witness les from middle marketing doing his best maurice greene directly for the fire extinguisher of which he is the only one in the office that has a clue where it is i see someone throwing a pitcher of egg yolk on the fire earlier which is funny if not for the fact that an old lady is missing half of her hair and her arms are about to blister up the blaze is extinguished after taking a hell of a toll on the old woman ruining the flat screen tv that used to sit above me and torching a bunch of cabinets and the backs of computer screens the alarm in our building world trade center is screaming and the smoke is enough to make even polarek leave the area so the fire departemnt comes and the old woman is now out of the building and on her way to the hospital who knows what condition she is in but all i know is i hope i am never around a bunch of vaginas myself and the rest of us that did nothing when i go up in flames someday well i have to get back to work because i have wasted about minutes writing this drama take care scotty pretty good story huh different morning things are going well here in portland other than the omelette fires when do you get in to seattle take care and enjoy your last month in colorado bill,0.7493993354586841,26048
bike pics who loves you baby,0.8342784231752038,27177
so you were looking for a one night stand afterall dc,0.8361042593556154,27540
happy birthday thanks man i feel like the old man that i am i only have years until it gets really bad hunting was great the dog did great he tried to attack a bull and went tearing through the brush i thought that i would never find him after he settled down he did great thanks for keeping the family tiffany told me that you guys taught her how to call the hogs brad,0.9755836499423002,28788
message those boys have wads of cash on hand i am sure they will pay you handsomely regardless of your decision message thats still true i was getting worried about chapter x filings a friend in bschool worked at arco when bp bought them she got a yr package where do i sign up message yes i did from what you mentioned it seemed as if we are a potential take over targe message did you get the message last night that the banks pulled it out for us,0.8159450184786158,28851
wireless message fwd fwd fwd r at airport cant wait to get home talking to an old man sitting next to us is going to s a graduated from brackenridge in o his wife went to alamo heights small world,0.8172158001676411,29723
good morning my love good morning honey i wish that i could have pulled it together enough to get up with you and take care of you this morning i really missed that thank you for waking me up and giving me kisses and love it was a sweet way to start the day today there is a meeting from ubs in about minutes i wonder what will be said i will let you know everything on the way to work i was thinking about us planning for our home i love the sound of our home i hated seeing all of your stuff packed away today i like snuggling with your pillows when you have gone to work soon we will both just be home hopefully i will be all done with my bullshit in time to meet you at the grotto before going to stanfords but if not i will meet you there at if i make it to the grotto by will that be enough time for you to pick them up as well i am calling the doctor when his office opens to complain about the medication i hope he gives me some more meds but he might tell me just to hang in there until the new lower level is stabilized last night was wonderful each time we are together i find something new to enjoy i love being with you holding you and feeling all of your touches and caresses you make me so happy and i want to make you happy i love that little grin on your face and the tenderness in your eyes you are a wonderful man and i am the luckiest woman in the world to have you in my life i love you cara,0.8651260034342803,30221
i am leaving for home now hi sweetheart the trip and all really took it out of me i am taking off for home now looking at a little nap action and then if i feel good start packing i love you and will see you this after noon dont work my man too hard but i will rub your feet when you get home if you do love cf,0.942125490168729,30248
a lady approaches a priest and tells him father i have a problem i have these two talking parrots but they only know how to say one thing what do they say the priest asked they only know how to say hi were prostitutes do you want to have some fun thats terrible the priest exclaimed i have a solution for your problem bring your female parrots over to the rectory and i will put them with my two male parrots whom i have taught to pray and read the bible my parrots will teach your parrots to stop saying that terrible phrase and your female parrots will learn to pray and worship the next day the lady brings her female parrots to the rectory the male parrots are holding rosary beads and praying in their cage the lady puts her parrots in with the male parrots and the females say hi were prostitutes do you want to have some fun one male parrot looks over at the other and squawks put your beads away frank our prayers have been answered,0.9929735976059585,30511
comments to policy guys i am faxing to you my comments to the latest draft of the policy in case i am not in the office tomorrow please call me or bill with your comments when convenient so that we can respond to ace looks like we are really close carol st clair eb phone fax carol st clair enron com,0.9799162479329837,31506
i think a mid sept tee time will work i want to try to be there for the off site with the west guys tell john z ill call him this afternoon chris,0.8684954538307252,38125
want to hear about a bad day down million usd today temps came in degress hotter than we thought in the northeast this week and blew up chris sounds good man we should maybe talk on the weekend i think a mid sept tee time will work i want to try to be there for the off site with the west guys tell john z ill call him this afternoon chris,0.9374551256657141,38127
did you buy any i have the golden touch at,0.9985856586402703,38176
mike can you light a fire under the phone guys in houston to look into fixing our line ill talk to our guy and get his gas in gear chris,0.9904012560146949,38332
word thanx ill give you a shout later word chris just wondering if things are cool give me a shout if you are heading into toronto or if you want to get in touch with anyone down here cheers secko,0.9515161636416636,38479
dont forget about oconnors chick,0.7268343097323203,38602
proposition we should grab some sushi and talk call me at work chris,0.8668186215833262,39655
hey my ytd nymx and your ytd nymx dont tie here is my worksheet would take a look at it and let me know which deals are wrong you are a wonderful person by the way,0.7515238996473612,40219
words of wisdom whatever happened to the good ol days the following is from an actual s home economics textbook intended for high school girls teaching them how to prepare for married life have dinner ready plan ahead even the night before to have a delicious meal on time this is a way of letting him know that you have been thinking about him and are concerned about his needs most men are hungry when they come home and the prospects of a good meal are part of the warm welcome needed prepare yourself take minutes to rest so you will be refreshed when he arrives touch up your makeup put a ribbon in your hair and be fresh looking he has just been with a lot of workweary people be a little gay and a little more interesting his boring day may need a lift clear away clutter make one last trip through the main part of the house just before your husband arrives gathering up schoolbooks toys paper etc then run a dust cloth over the tables your husband will feel he has reached a haven of rest and order and it will give you a lift too prepare the children take a few minutes to wash the childrens hands and faces if they are small comb their hair and if necessary change their clothes they are little treasures and he would like to see them playing the part minimize the noise at the time of his arrival eliminate all noise of washer dryer or vacuum try to encourage the children to be quiet greet him with a warm smile and kiss letting him know youre glad to see him some donts dont greet him with problems or complaints dont complain if hes late for dinner count this as minor compared with what he might have gone through that day make him comfortable have him lean back in a comfortable chair or suggest he lay down in the bedroom have a cool or warm drink ready for him arrange his pillow and offer to take off his shoes speak in a low soft soothing and pleasant voice allow him to relax and unwind listen to him you may have a dozen things to tell him but the moment of his arrival is not the time let him talk first make the evening his never complain if he does not take you out to dinner or to other places of entertainment instead try to understand his world of strain and pressure and his need to be home and relax the goal try to make your home a place of peace and order where your husband can relax,0.8147046599809484,40387
vaca hey woman how much vacation do i have left before i fill out a timesheet for the nd part of august,0.7757625414109719,40566
hey i tried to call you to hassel you again the phone rang times and i hung up,0.902476716716085,42180
this is my beautiful transport worksheet for uncle frenchy what do you think,0.9489690265542674,42252
boss a boss and two of his employees are on their way to a meeting walking through a park they find a miracle lamp they rub it and suddenly a genie appears the genie says normally the one who frees me has three wishes free now you are three persons so everyone of you has one wish the first employee yells me first me first and expresses his wish i would like to be on the bahamas on a very fast yacht and have no more worries and pfffffff he is away now the second employee yells me next me next and he expresses his wish i would like to be in the caribbean along with the prettiest girls of the world and an inexhaustible source of exotic cocktails and pfffffff he is away and what is your wish the genie asks the boss and the boss replies i want these two idiots to be back in office after lunch and the moral of this story always let your boss speak first,0.8852398904148073,42926
meeting time change sorry but cng called back late yesterday and asked to move next weeks meeting from pm to pm we will still meet in room c thanks md,0.7415781180551732,45727
cng sabine no replying this late at night then i dont have an excuse for not doing my job,0.8260923698140141,45945
here is the phone number for the kennel heres how you get there take jfk south away from the airport accross beltway to aldinebender next major intersection after the beltway take a right on aldinebender and go to the nd street which is milner there are no lights at milner and aldine you just have to watch for the road go block to renton take a left on renton and its the nd or rd house down,0.8115486797278301,46011
two boys two small boys not yet old enough to be in school were overheard talking at the zoo one day my name is billy whats yours asked the first boy tommy replied the second my daddys an accountant what does your daddy do for a living asked billy tommy replied my daddys a lawyer honest asked billy no just the regular kind replied tommy,0.8608644073924002,46094
hey call me when you get out of your morning meeting,0.86076726498626,46245
ces jan billing please unsuspend and bill the following jan ces deals deal pipe volume amount comment anr we billed the trunkline piece of this deal anr anr still researching the following deals deal pipe volume amount comment anr sent email to tom donoho to research i will be in after lunch i may try to send you more deals,0.9017064325972435,46533
bus passes please bill ainsley gaddiss bus pass to rc thanks chris stokley,0.7507118667287562,48668
bus pass i think so sent the email thursday bus pass did you get ainsley sorted out nfb,0.7156436074535197,48670
feel free to edit comment thanks,0.8625331327859951,49991
dream girl wanted to send you a reference to my dream girl http www ecologyproject org staff html scroll down to the julie osborn section i used to work with her in berkeley,0.8162532550488472,51536
eze i got your message and i might be up for yoga tonight i went to core last night and it was nice and mellow do you have any idea who teaches the class i went a while back and it this hyperactive guy taught the class and it wasnt so good adding that to the rockne risk makes it a dangerious proposition do you happen to have janices email address jai and i havent been to earls in a long time and i was wondering how she was doing if you see her when youre working tell her i said hi c,0.8162559577051384,51686
its me hey baby i dont know if this email looks like its from me anyway im really tired i got probably about hours of sleep but i guess it wasnt enough its gonna be a long week okay days im sorry about waking you up last night im meeting jen garcia at to work on the project but i should be home around have fun working out tonight i will call you when i get home but i will try to email you again love you jenn by the waydid you email my mom,0.8887719037657438,52941
party in the heyouse hey guys my friends and i are throwing a little soiree at my place tomorrow night around or so i know it looks like only guys are being invited to this deal but i assure you there will be girls there too theyve already been invited if you want to bring beer bottle wine whatever thats fine but no obligation there should be plenty for everyone to eat drink meet mary feel free to bring more people too i live on the corner of fannin capitol in the st germain park anywhere on the street its the walkthru gate by the garage doors the code is go through the hallway veer to the left up the elevator to,0.9560739866513277,52949
reminder girl you better go n,0.8978668584749944,55025
i tried to catch you before i left for this hlaa luncheon it started at to cya when i get back,0.9765081174158071,55038
terminal server dana please try this at home,0.7563057283492768,55683
pictures hey tony tony i have to look for it ill check pictures tony sumbler inventory analyst brittmore road houston tx tel fax tsumbler universalcompression com pictures do you still have the video on the guy in the woods taking the fish from the bear if so email it to me thanks tony sumbler inventory analyst brittmore road houston tx tel fax tsumbler universalcompression com,0.8271037898936192,55715
football farts an old man and his wife have gone to bed after lying in bed for a few minutes the old man cuts a fart and says seven points his wife rolls over and says what in the world was that touchdown im ahead to nothing a few minutes later the wife lets one go and says touchdown tie score after about ten minutes the old man farts again and says touchdown im ahead to now starting to get into it the wife quickly farts again and says touchdown tie score the old man not to be outdone strains really hard but to no avail he cant fart so not to be outdone by his wife he gives it everything he has trying for one more fart straining real hard the old man shits the bed the wife asks what in the hell was that the old man replies halftime switch sides,0.7104361152660118,59691
the kiss a young marine and his commanding officer board a train headed through the mountains of switzerland they can find no place to sit except for two seats right across the aisle from a young woman and her grandmother after a while it is obvious that the young woman and the young soldier are interested in each other because they are giving each other looks soon the train passes into a tunnel and it is pitch black there is a sound of the smack of a kiss followed by the sound of the smack of a slap when the train emerges from the tunnel the four sit there without saying a word the grandmother is thinking to herself it was very brash for that young soldier to kiss my granddaughter but im glad she slapped him the commanding officer is setting there thinking i didnt know the young marine was brave enough to kiss the girl but i sure wish she hadnt missed him when she slapped and hit me the young woman was sitting and thinking im glad the soldier kissed me but i wish my grandmother had not slapped him the young marine sat there with a satisfied smile on his face thinking to himself life is good when does a fellow have the chance to kiss a beautiful girl and slap his commanding officer all at the same time,0.9685087982901511,60815
